{"run":14,"commit":"207b789","metric":15.662,"metrics":{"complete_ms":45.155,"critical_bytes":37891,"complete_bytes":265412,"data_regressions":0,"harnesses_ms":1.412,"harnesses_bytes":62,"activity_ms":13.252,"activity_bytes":34040,"work_rhythm_ms":15.17,"work_rhythm_bytes":3789,"work_rhythm_days_ms":14.964,"work_rhythm_days_bytes":205026,"session_shape_ms":12.392,"session_shape_bytes":1157,"usage_ms":28.536,"usage_bytes":17466,"cache_misses_ms":26.385,"cache_misses_bytes":3872,"activity_root_rollups_ms":0.6,"activity_cache_misses_ms":2.2,"activity_aggregate_ms":0.9,"work_rhythm_root_rollups_ms":0.7,"work_rhythm_root_execution_intervals_ms":4.5,"work_rhythm_work_rhythm_ms":1.3,"work_rhythm_session_diagnostics_ms":0,"work_rhythm_aggregate_ms":1.3,"work_rhythm_days_root_rollups_ms":0.5,"work_rhythm_days_root_execution_intervals_ms":4.4,"work_rhythm_days_work_rhythm_days_ms":0,"work_rhythm_days_work_rhythm_ms":3.4,"work_rhythm_days_session_diagnostics_ms":0.4,"work_rhythm_days_aggregate_ms":3.7},"status":"keep","description":"Move work-rhythm session diagnostics into the deferred days response so the summary stays lightweight.","timestamp":1788383948959,"segment":3,"confidence":null,"asi":{"hypothesis":"Session diagnostics is below the fold and accounts for most of the work-rhythm summary payload; return it with the deferred calendar/details response instead.","observations":"The summary shrank from 73,039 to 3,789 bytes and critical_bytes from 107,141 to 37,891; critical_ms improved from 16.92 to 15.66 ms. Complete bytes stayed 265,412 and complete_ms was 45.16 ms.","data_guard":"All guarded responses matched; days now carries sessionDiagnostics and the work-rhythm split remains intentionally exempt from equality checks.","simplicity":"Reuses the existing full work-rhythm aggregation for the days request and adds one narrow summary schema; no new endpoint."}}
{"run":15,"commit":"0270590","metric":12.862,"metrics":{"complete_ms":40.821,"critical_bytes":37891,"complete_bytes":265412,"data_regressions":0,"harnesses_ms":2.313,"harnesses_bytes":62,"activity_ms":5.646,"activity_bytes":34040,"work_rhythm_ms":11.516,"work_rhythm_bytes":3789,"work_rhythm_days_ms":13.306,"work_rhythm_days_bytes":205026,"session_shape_ms":13.193,"session_shape_bytes":1157,"usage_ms":21.573,"usage_bytes":17466,"cache_misses_ms":27.594,"cache_misses_bytes":3872,"activity_root_rollups_ms":0.6,"activity_cache_misses_ms":2.1,"activity_aggregate_ms":0.7,"work_rhythm_root_rollups_ms":0.5,"work_rhythm_root_execution_intervals_ms":4.1,"work_rhythm_work_rhythm_ms":1.3,"work_rhythm_session_diagnostics_ms":0,"work_rhythm_aggregate_ms":1.3,"work_rhythm_days_root_rollups_ms":0.5,"work_rhythm_days_root_execution_intervals_ms":4,"work_rhythm_days_work_rhythm_days_ms":0,"work_rhythm_days_work_rhythm_ms":3.3,"work_rhythm_days_session_diagnostics_ms":0.2,"work_rhythm_days_aggregate_ms":3.5},"status":"keep","description":"Confirm the lightweight work-rhythm summary and deferred diagnostics split with seven samples.","timestamp":1788383972326,"segment":3,"confidence":3.232854864433813,"asi":{"hypothesis":"A seven-sample repeat should confirm that moving the large diagnostics payload out of the summary is a real critical-path improvement rather than request-order noise.","observations":"Confirmation critical_ms was 12.86 ms and complete_ms 40.82 ms; bytes and response guards were unchanged from the candidate. The improvement over the 16.92 ms phase baseline is substantial, though endpoint medians remain variable.","data_guard":"All guarded non-rhythm responses matched.","simplicity":"Same narrow response-contract split; no additional implementation."}}
{"run":16,"commit":"0270590","metric":16.579,"metrics":{"complete_ms":52.61,"critical_bytes":37840,"complete_bytes":265337,"data_regressions":1,"harnesses_ms":8.147,"harnesses_bytes":62,"activity_ms":7.445,"activity_bytes":33989,"work_rhythm_ms":14.722,"work_rhythm_bytes":3789,"work_rhythm_days_ms":13.937,"work_rhythm_days_bytes":205002,"session_shape_ms":12.12,"session_shape_bytes":1157,"usage_ms":32.917,"usage_bytes":17466,"cache_misses_ms":23.252,"cache_misses_bytes":3872,"activity_root_rollups_ms":0.7,"activity_cache_misses_ms":2.3,"activity_aggregate_ms":0.7,"work_rhythm_root_rollups_ms":0.5,"work_rhythm_root_execution_intervals_ms":6.9,"work_rhythm_work_rhythm_ms":1.5,"work_rhythm_session_diagnostics_ms":0,"work_rhythm_aggregate_ms":1.5,"work_rhythm_days_root_rollups_ms":0.6,"work_rhythm_days_root_execution_intervals_ms":4.3,"work_rhythm_days_work_rhythm_days_ms":0,"work_rhythm_days_work_rhythm_ms":3.4,"work_rhythm_days_session_diagnostics_ms":0.2,"work_rhythm_days_aggregate_ms":3.7},"status":"checks_failed","description":"Remove ordering from root-rollup, descendant-spend, and interval aggregate queries; response guards detected a regression.","timestamp":1788384119846,"segment":3,"confidence":6.465709728867617,"asi":{"hypothesis":"The list and grouped interval results are consumed through maps and downstream sorting, so their SQL ORDER BY clauses may be unnecessary and could remove temporary sorts.","observations":"Timing was not consistently better and the benchmark reported one guarded data regression with changed bytes; removing ordering changed response ordering in at least one guarded endpoint.","rollback_reason":"Response-data guards failed, so the candidate is not safe even though the core timing sample was comparable.","next_action_hint":"Retain the prior ordering guarantees; only test order removal with explicit canonicalization or endpoint-specific proof if the sort cost becomes material."}}
{"run":17,"commit":"f41a975","metric":12.122,"metrics":{"complete_ms":39.654,"critical_bytes":37891,"complete_bytes":265412,"data_regressions":0,"harnesses_ms":1.347,"harnesses_bytes":62,"activity_ms":5.354,"activity_bytes":34040,"work_rhythm_ms":11.797,"work_rhythm_bytes":3789,"work_rhythm_days_ms":18.382,"work_rhythm_days_bytes":205026,"session_shape_ms":18.238,"session_shape_bytes":1157,"usage_ms":17.098,"usage_bytes":17466,"cache_misses_ms":26.993,"cache_misses_bytes":3872,"activity_root_rollups_ms":0.5,"activity_cache_misses_ms":2,"activity_aggregate_ms":0.7,"work_rhythm_root_rollups_ms":0.5,"work_rhythm_root_execution_intervals_ms":4.1,"work_rhythm_work_rhythm_ms":1.3,"work_rhythm_session_diagnostics_ms":0,"work_rhythm_aggregate_ms":1.3,"work_rhythm_days_root_rollups_ms":0.5,"work_rhythm_days_root_execution_intervals_ms":4,"work_rhythm_days_work_rhythm_days_ms":0,"work_rhythm_days_work_rhythm_ms":3.2,"work_rhythm_days_session_diagnostics_ms":0.2,"work_rhythm_days_aggregate_ms":3.4},"status":"keep","description":"Cover the root turn fields used by work-rhythm interval loading.","timestamp":1788384189384,"segment":3,"confidence":3.822966507177035,"asi":{"hypothesis":"A covering index on conversation_turns(conversation_id, id, started_at, ordinal) should remove table lookups from the root turn side of the work-rhythm interval query.","observations":"Critical_ms was 12.12 ms versus the 12.86 ms prior candidate and complete_ms 39.65 ms versus 40.82 ms; the root interval phase stayed around 4.1 ms in this concurrent run.","data_guard":"All guarded responses matched and byte counts stayed stable.","simplicity":"One narrow additive index migration; no query or response contract changes."}}
{"run":18,"commit":"f41a975","metric":14.581,"metrics":{"complete_ms":43.089,"critical_bytes":37891,"complete_bytes":265412,"data_regressions":0,"harnesses_ms":2.994,"harnesses_bytes":62,"activity_ms":7.174,"activity_bytes":34040,"work_rhythm_ms":14.085,"work_rhythm_bytes":3789,"work_rhythm_days_ms":19.856,"work_rhythm_days_bytes":205026,"session_shape_ms":22.202,"session_shape_bytes":1157,"usage_ms":28.574,"usage_bytes":17466,"cache_misses_ms":10.016,"cache_misses_bytes":3872,"activity_root_rollups_ms":0.6,"activity_cache_misses_ms":2.2,"activity_aggregate_ms":0.6,"work_rhythm_root_rollups_ms":0.5,"work_rhythm_root_execution_intervals_ms":4,"work_rhythm_work_rhythm_ms":1.4,"work_rhythm_session_diagnostics_ms":0,"work_rhythm_aggregate_ms":1.4,"work_rhythm_days_root_rollups_ms":0.5,"work_rhythm_days_root_execution_intervals_ms":4,"work_rhythm_days_work_rhythm_days_ms":0,"work_rhythm_days_work_rhythm_ms":3,"work_rhythm_days_session_diagnostics_ms":0.2,"work_rhythm_days_aggregate_ms":3.2},"status":"discard","description":"Repeat the root-turn covering-index candidate; the lower isolated phase did not reproduce in the concurrent median.","timestamp":1788384207655,"segment":3,"confidence":2.948339483394835,"asi":{"hypothesis":"A second concurrent repeat should distinguish the turn covering index's small gain from request-order noise.","observations":"The repeat median was 14.58 ms versus 12.12 ms for the candidate, while root execution remained about 4.0 ms; all response guards passed. The additive index may still help isolated reads, but this run cannot confirm a critical-path gain.","rollback_reason":"The candidate's concurrent improvement was not reproduced; retain only the already-kept query/index changes rather than claiming this marginal run.","next_action_hint":"Keep the index for now because the first run improved complete_ms and the query is on the measured path; prioritize larger query reuse or scheduling gains before another index variant."}}
{"run":19,"commit":"fac5581","metric":11.947,"metrics":{"complete_ms":36.353,"critical_bytes":37891,"complete_bytes":265412,"data_regressions":0,"harnesses_ms":1.51,"harnesses_bytes":62,"activity_ms":10.225,"activity_bytes":34040,"work_rhythm_ms":11.551,"work_rhythm_bytes":3789,"work_rhythm_days_ms":15.516,"work_rhythm_days_bytes":205026,"session_shape_ms":14.462,"session_shape_bytes":1157,"usage_ms":18.709,"usage_bytes":17466,"cache_misses_ms":22.155,"cache_misses_bytes":3872,"activity_root_rollups_ms":0.6,"activity_root_execution_intervals_ms":4,"activity_cache_misses_ms":2.1,"activity_aggregate_ms":0.7,"work_rhythm_root_rollups_ms":0,"work_rhythm_root_execution_intervals_ms":0,"work_rhythm_work_rhythm_ms":1.4,"work_rhythm_session_diagnostics_ms":0,"work_rhythm_aggregate_ms":1.4,"work_rhythm_days_root_rollups_ms":0,"work_rhythm_days_root_execution_intervals_ms":0,"work_rhythm_days_work_rhythm_days_ms":0,"work_rhythm_days_work_rhythm_ms":3.1,"work_rhythm_days_session_diagnostics_ms":0.4,"work_rhythm_days_aggregate_ms":3.4},"status":"keep","description":"Reuse the full overview rollup materialization across the initial core requests.","timestamp":1788384345299,"segment":3,"confidence":2.4869869869869863,"asi":{"hypothesis":"Activity and work-rhythm requests need the same root rollups but previously requested different optional fields; loading the full superset once lets the synchronous requests share one short-lived materialization.","observations":"The cache coalesced the duplicate core and days loads in the benchmark; critical_ms was 11.95 ms and complete_ms 36.35 ms versus 12.12/39.65, with the work-rhythm database phases absent on cache hits.","data_guard":"All guarded responses matched and response sizes stayed unchanged.","simplicity":"A single 25 ms in-memory entry is cleared after sync; callers use the existing repository and no persistent cache or worker pool was added."}}
{"run":20,"commit":"8a8198a","metric":11.502,"metrics":{"complete_ms":35.523,"critical_bytes":37891,"complete_bytes":265412,"data_regressions":0,"harnesses_ms":9.904,"harnesses_bytes":62,"activity_ms":9.79,"activity_bytes":34040,"work_rhythm_ms":10.888,"work_rhythm_bytes":3789,"work_rhythm_days_ms":6.476,"work_rhythm_days_bytes":205026,"session_shape_ms":7.198,"session_shape_bytes":1157,"usage_ms":23.279,"usage_bytes":17466,"cache_misses_ms":22.734,"cache_misses_bytes":3872,"activity_root_rollups_ms":0.7,"activity_root_execution_intervals_ms":4.3,"activity_cache_misses_ms":2.1,"activity_aggregate_ms":0.7,"work_rhythm_root_rollups_ms":0,"work_rhythm_root_execution_intervals_ms":0,"work_rhythm_work_rhythm_ms":1.4,"work_rhythm_session_diagnostics_ms":0,"work_rhythm_aggregate_ms":1.4,"work_rhythm_days_root_rollups_ms":0,"work_rhythm_days_root_execution_intervals_ms":0,"work_rhythm_days_work_rhythm_days_ms":0,"work_rhythm_days_work_rhythm_ms":3.4,"work_rhythm_days_session_diagnostics_ms":0.2,"work_rhythm_days_aggregate_ms":3.6},"status":"keep","description":"Confirm short-lived overview-rollup reuse with seven samples.","timestamp":1788384359836,"segment":3,"confidence":2.9146702557200523,"asi":{"hypothesis":"The cache should consistently coalesce full overview rollups across initial requests rather than relying on one favorable request order.","observations":"Seven-sample confirmation reached 11.50 ms critical and 35.52 ms complete, improving on the candidate's 11.95/36.35; cache-hit database phases remained absent for the later core request and days request.","data_guard":"All guarded responses matched.","simplicity":"No implementation changes from the kept 25 ms materialization cache."}}
{"run":21,"commit":"8a8198a","metric":11.717,"metrics":{"complete_ms":34.501,"critical_bytes":37891,"complete_bytes":265412,"data_regressions":0,"harnesses_ms":6.838,"harnesses_bytes":62,"activity_ms":9.987,"activity_bytes":34040,"work_rhythm_ms":10.95,"work_rhythm_bytes":3789,"work_rhythm_days_ms":7.802,"work_rhythm_days_bytes":205026,"session_shape_ms":11.506,"session_shape_bytes":1157,"usage_ms":20.339,"usage_bytes":17466,"cache_misses_ms":18.931,"cache_misses_bytes":3872,"activity_root_rollups_ms":0.5,"activity_root_execution_intervals_ms":4.3,"activity_cache_misses_ms":2.2,"activity_aggregate_ms":0.6,"work_rhythm_root_rollups_ms":0,"work_rhythm_root_execution_intervals_ms":0,"work_rhythm_work_rhythm_ms":1.1,"work_rhythm_session_diagnostics_ms":0,"work_rhythm_aggregate_ms":1.1,"work_rhythm_days_root_rollups_ms":0,"work_rhythm_days_root_execution_intervals_ms":0,"work_rhythm_days_work_rhythm_days_ms":0,"work_rhythm_days_work_rhythm_ms":3.3,"work_rhythm_days_session_diagnostics_ms":0.2,"work_rhythm_days_aggregate_ms":3.5},"status":"discard","description":"Run an eleven-sample confirmation of rollup reuse; it did not beat the kept candidate's median.","timestamp":1788384438044,"segment":3,"confidence":3.980882352941178,"asi":{"hypothesis":"A larger sample should verify that the short-lived cache's critical-path benefit is not an artifact of five-sample request ordering.","observations":"Eleven-sample critical_ms was 11.72 ms and complete_ms 34.50 ms, close to but above the kept 11.50/35.52 result; cache-hit timing behavior and data guards remained stable.","rollback_reason":"This run did not improve the already-kept candidate; no code was changed or reverted.","next_action_hint":"Retain the 25 ms coalescing cache and investigate only optimizations that reduce the uncached full materialization or activity cache-miss query."}}
{"run":22,"commit":"8a8198a","metric":12.026,"metrics":{"complete_ms":36.262,"critical_bytes":37891,"complete_bytes":265412,"data_regressions":0,"harnesses_ms":10.559,"harnesses_bytes":62,"activity_ms":9.921,"activity_bytes":34040,"work_rhythm_ms":11.659,"work_rhythm_bytes":3789,"work_rhythm_days_ms":6.646,"work_rhythm_days_bytes":205026,"session_shape_ms":16.808,"session_shape_bytes":1157,"usage_ms":22.195,"usage_bytes":17466,"cache_misses_ms":16.757,"cache_misses_bytes":3872,"activity_root_rollups_ms":0.6,"activity_root_execution_intervals_ms":4.1,"activity_cache_misses_ms":2.1,"activity_aggregate_ms":0.7,"work_rhythm_root_rollups_ms":0,"work_rhythm_root_execution_intervals_ms":0,"work_rhythm_work_rhythm_ms":1.5,"work_rhythm_session_diagnostics_ms":0,"work_rhythm_aggregate_ms":1.5,"work_rhythm_days_root_rollups_ms":0,"work_rhythm_days_root_execution_intervals_ms":0,"work_rhythm_days_work_rhythm_days_ms":0,"work_rhythm_days_work_rhythm_ms":3.4,"work_rhythm_days_session_diagnostics_ms":0.2,"work_rhythm_days_aggregate_ms":3.6},"status":"discard","description":"Remove MATERIALIZED from the selected-root CTE; the uncached query shape did not improve the critical path.","timestamp":1788384473398,"segment":3,"confidence":6.134844192634558,"asi":{"hypothesis":"The selected root CTE is consumed once, so allowing SQLite to flatten it might avoid materialization overhead in the root interval query.","observations":"The seven-sample median was 12.03 ms versus the kept 11.50 ms; response guards passed and no stable phase reduction was visible.","rollback_reason":"The candidate was slower on the primary metric and did not provide a measurable query benefit.","next_action_hint":"Restore MATERIALIZED and prioritize repository-level reuse or the cache-miss query rather than speculative CTE flattening."}}
{"run":23,"commit":"8a8198a","metric":13.206,"metrics":{"complete_ms":39.295,"critical_bytes":37891,"complete_bytes":265412,"data_regressions":0,"harnesses_ms":11.728,"harnesses_bytes":62,"activity_ms":12.091,"activity_bytes":34040,"work_rhythm_ms":10.539,"work_rhythm_bytes":3789,"work_rhythm_days_ms":9.806,"work_rhythm_days_bytes":205026,"session_shape_ms":22.825,"session_shape_bytes":1157,"usage_ms":21.592,"usage_bytes":17466,"cache_misses_ms":15.112,"cache_misses_bytes":3872,"activity_root_rollups_ms":0,"activity_root_execution_intervals_ms":0,"activity_cache_misses_ms":2,"activity_aggregate_ms":0.7,"work_rhythm_root_rollups_ms":0.6,"work_rhythm_root_execution_intervals_ms":4,"work_rhythm_work_rhythm_ms":1.2,"work_rhythm_session_diagnostics_ms":0,"work_rhythm_aggregate_ms":1.2,"work_rhythm_days_root_rollups_ms":0,"work_rhythm_days_root_execution_intervals_ms":0,"work_rhythm_days_work_rhythm_days_ms":0,"work_rhythm_days_work_rhythm_ms":3.1,"work_rhythm_days_session_diagnostics_ms":0.2,"work_rhythm_days_aggregate_ms":3.4},"status":"discard","description":"Cache grouped cache-miss summaries for the activity and deferred cache endpoints; the request gap outlasted the short cache.","timestamp":1788384564018,"segment":3,"confidence":4.728384279475984,"asi":{"hypothesis":"The activity overview already computes grouped cache-miss rows; a 25 ms repository cache could let the deferred Cache misses section reuse that materialization.","observations":"The median was 13.21 ms critical and 39.30 ms complete, worse than the kept 11.50/35.52; cache-misses endpoint timing remained variable and did not consistently hit the new cache.","rollback_reason":"The extra cache added complexity without a primary or complete-path gain in the representative schedule.","next_action_hint":"Do not retain a separate cache-miss cache; preserve the simpler rollup cache and focus on reducing cache-miss query cost only if it affects the core path."}}
{"run":24,"commit":"8a8198a","metric":11.553,"metrics":{"complete_ms":38.118,"critical_bytes":37891,"complete_bytes":265412,"data_regressions":1,"harnesses_ms":4.671,"harnesses_bytes":62,"activity_ms":9.258,"activity_bytes":34040,"work_rhythm_ms":11.17,"work_rhythm_bytes":3789,"work_rhythm_days_ms":6.241,"work_rhythm_days_bytes":205026,"session_shape_ms":22.93,"session_shape_bytes":1157,"usage_ms":21.619,"usage_bytes":17466,"cache_misses_ms":15.167,"cache_misses_bytes":3872,"activity_root_rollups_ms":0.6,"activity_root_execution_intervals_ms":4.2,"activity_cache_misses_ms":1.4,"activity_aggregate_ms":0.8,"work_rhythm_root_rollups_ms":0,"work_rhythm_root_execution_intervals_ms":0,"work_rhythm_work_rhythm_ms":1.4,"work_rhythm_session_diagnostics_ms":0,"work_rhythm_aggregate_ms":1.4,"work_rhythm_days_root_rollups_ms":0,"work_rhythm_days_root_execution_intervals_ms":0,"work_rhythm_days_work_rhythm_days_ms":0,"work_rhythm_days_work_rhythm_ms":3.4,"work_rhythm_days_session_diagnostics_ms":0.2,"work_rhythm_days_aggregate_ms":3.5},"status":"checks_failed","description":"Replace grouped cache-miss aggregation with a direct SQL SUM; floating-point order changed the guarded activity response.","timestamp":1788384714259,"segment":3,"confidence":6.317386231038505,"asi":{"hypothesis":"A direct SQL SUM can compute only the activity endpoint's needed attributed cache-miss cost without materializing grouped rows.","observations":"The direct sum differed from the existing JavaScript reduction by 7.1e-15, changing summary.spendAtMissCalls and causing one guarded response mismatch; timing was not a reliable improvement.","rollback_reason":"The benchmark requires exact response preservation and the candidate changed a floating-point JSON value.","next_action_hint":"Keep the grouped aggregation for exact semantics; if revisited, preserve the original summation order rather than using SQL SUM."}}
