{"type":"config","name":"Main page responsiveness on the representative local archive","metricName":"critical_ms","metricUnit":"ms","bestDirection":"lower"}
{"run":1,"commit":"b70b86d","metric":53.291,"metrics":{"complete_ms":53.291,"critical_bytes":263372,"data_regressions":0,"harnesses_ms":5.016,"harnesses_bytes":62,"activity_ms":47.606,"activity_bytes":34067,"work_rhythm_ms":49.048,"work_rhythm_bytes":206770,"session_shape_ms":43.112,"session_shape_bytes":1154,"usage_ms":27.373,"usage_bytes":17446,"cache_misses_ms":35.032,"cache_misses_bytes":3873,"activity_root_rollups_ms":0.7,"activity_cache_misses_ms":2.2,"activity_aggregate_ms":0.7,"work_rhythm_root_rollups_ms":0.8,"work_rhythm_root_execution_intervals_ms":9.1,"work_rhythm_aggregate_ms":4.5},"status":"keep","description":"Baseline cache-busted concurrent main-page API load on the representative archive.","timestamp":1788382232877,"segment":0,"confidence":null,"asi":{"hypothesis":"Establish a repeated cache-busted concurrent baseline before changing query ownership or request scheduling.","archive":"local archive.sqlite via the running dev server","observations":"Work-rhythm is the largest payload and its root execution interval phase is the largest measured server phase; endpoint wall times serialize through the single synchronous connection.","data_guard":"Reference JSON captured for harnesses, activity, session shape, usage, and cache-miss responses; work-rhythm excluded by design."}}
{"run":2,"commit":"b70b86d","metric":42.544,"metrics":{"complete_ms":42.544,"critical_bytes":263372,"data_regressions":0,"harnesses_ms":14.576,"harnesses_bytes":62,"activity_ms":24.19,"activity_bytes":34067,"work_rhythm_ms":38.443,"work_rhythm_bytes":206770,"session_shape_ms":20.447,"session_shape_bytes":1154,"usage_ms":28.408,"usage_bytes":17446,"cache_misses_ms":25.017,"cache_misses_bytes":3873,"activity_root_rollups_ms":0.6,"activity_cache_misses_ms":2.1,"activity_aggregate_ms":0.6,"work_rhythm_root_rollups_ms":0.5,"work_rhythm_root_execution_intervals_ms":8.1,"work_rhythm_aggregate_ms":3.8},"status":"discard","description":"Repeat baseline measurement to estimate timing noise; no implementation change.","timestamp":1788382322491,"segment":0,"confidence":null,"asi":{"hypothesis":"A second unchanged run would reveal whether the 53 ms baseline was stable enough to use as the comparison.","rollback_reason":"No code changed; the lower 42.5 ms result is measurement noise rather than an optimization.","next_action_hint":"Use per-phase medians and response sizes to target the root execution interval query and large work-rhythm payload instead of trusting one run."}}
{"run":3,"commit":"b70b86d","metric":39.592,"metrics":{"complete_ms":39.592,"critical_bytes":263372,"data_regressions":0,"harnesses_ms":1.864,"harnesses_bytes":62,"activity_ms":29.496,"activity_bytes":34067,"work_rhythm_ms":20.046,"work_rhythm_bytes":206770,"session_shape_ms":31.209,"session_shape_bytes":1154,"usage_ms":27.592,"usage_bytes":17446,"cache_misses_ms":29.768,"cache_misses_bytes":3873,"activity_root_rollups_ms":0.7,"activity_cache_misses_ms":2.3,"activity_aggregate_ms":0.6,"work_rhythm_root_rollups_ms":0.6,"work_rhythm_root_execution_intervals_ms":8.4,"work_rhythm_aggregate_ms":3.3},"status":"discard","description":"Diagnostic run through the API port with seven samples to separate Vite proxy overhead from server work.","timestamp":1788382379522,"segment":0,"confidence":null,"asi":{"hypothesis":"The proxy may be contributing enough variance to obscure query-level wins, so compare the same cache-busted concurrent load directly against port 9000.","rollback_reason":"This is not comparable to the page URL baseline and made no code change.","next_action_hint":"Keep the page-port benchmark as the primary contract, but use Server-Timing and direct probes for query diagnosis; avoid calling timing noise an optimization."}}
{"run":4,"commit":"b70b86d","metric":0,"metrics":{"complete_ms":41.962,"critical_bytes":265447,"data_regressions":4,"harnesses_ms":8.098,"harnesses_bytes":62,"activity_ms":8.765,"activity_bytes":34034,"work_rhythm_ms":30.778,"work_rhythm_bytes":208870,"session_shape_ms":28.144,"session_shape_bytes":1159,"usage_ms":38.805,"usage_bytes":17450,"cache_misses_ms":32.2,"cache_misses_bytes":3872,"activity_root_rollups_ms":0.7,"activity_cache_misses_ms":2.2,"activity_aggregate_ms":0.7,"work_rhythm_root_rollups_ms":0.7,"work_rhythm_root_execution_intervals_ms":8.3,"work_rhythm_aggregate_ms":3.2},"status":"checks_failed","description":"Remove the inner root-interval ORDER BY to avoid a temporary sort; timing looked lower but the mutable live archive changed during the run.","timestamp":1788382446678,"segment":0,"confidence":null,"asi":{"hypothesis":"Removing the inner JSON aggregation sort should preserve work-rhythm semantics because estimatedWorkIntervals sorts inputs, while eliminating one temporary B-tree.","rollback_reason":"The response guard found four non-rhythm mismatches, but the archive changed between the baseline and candidate; this was not a trustworthy code regression. The candidate was reverted pending a stable fixture.","next_action_hint":"Freeze a consistent database snapshot or add a database-generation guard, recapture references, then re-test query simplifications."}}
{"type":"config","name":"Main page responsiveness on a stable representative archive","metricName":"critical_ms","metricUnit":"ms","bestDirection":"lower"}
{"run":5,"commit":"002b5bc","metric":41.828,"metrics":{"complete_ms":41.828,"critical_bytes":265361,"data_regressions":0,"harnesses_ms":25.019,"harnesses_bytes":62,"activity_ms":33.856,"activity_bytes":34040,"work_rhythm_ms":29.269,"work_rhythm_bytes":208764,"session_shape_ms":10.698,"session_shape_bytes":1157,"usage_ms":15.079,"usage_bytes":17466,"cache_misses_ms":36.049,"cache_misses_bytes":3872,"activity_root_rollups_ms":0.5,"activity_cache_misses_ms":2.2,"activity_aggregate_ms":0.8,"work_rhythm_root_rollups_ms":0.6,"work_rhythm_root_execution_intervals_ms":8.2,"work_rhythm_aggregate_ms":4.2},"status":"keep","description":"Stable-snapshot baseline for the concurrent main-page API workload.","timestamp":1788382574744,"segment":1,"confidence":null,"asi":{"hypothesis":"Recapture a comparable baseline after freezing the archive snapshot.","archive":"auto/archive.sqlite, 146 roots in the 30-day range","observations":"The initial request set is dominated by serialized endpoint waits; work-rhythm still spends about 8 ms in root execution interval loading and returns about 209 KB, while non-rhythm response checks are clean.","data_guard":"References recreated from the fixed snapshot; work-rhythm remains intentionally exempt from exact equality."}}
{"run":6,"commit":"db7feb5","metric":37.23,"metrics":{"complete_ms":37.23,"critical_bytes":265361,"data_regressions":0,"harnesses_ms":25.409,"harnesses_bytes":62,"activity_ms":6.28,"activity_bytes":34040,"work_rhythm_ms":16.805,"work_rhythm_bytes":208764,"session_shape_ms":7.24,"session_shape_bytes":1157,"usage_ms":36.16,"usage_bytes":17466,"cache_misses_ms":33.803,"cache_misses_bytes":3872,"activity_root_rollups_ms":0.7,"activity_cache_misses_ms":2.1,"activity_aggregate_ms":0.8,"work_rhythm_root_rollups_ms":0.5,"work_rhythm_root_execution_intervals_ms":4.8,"work_rhythm_aggregate_ms":4},"status":"keep","description":"Add a covering index for tool execution timestamps used by root work-rhythm interval loading.","timestamp":1788382682498,"segment":1,"confidence":null,"asi":{"hypothesis":"A covering index on (model_call_id, completed_at, started_at) should let the root execution interval query satisfy its tool-event join from the index instead of looking up table rows.","observations":"The isolated query fell from about 6.2 ms to 3.2 ms with this index; the stable concurrent page median fell from 41.83 ms to 37.23 ms, and the server-reported work-rhythm interval phase fell from 8.2 ms to 4.8 ms.","data_guard":"All non-rhythm reference responses matched; work-rhythm payload size and schema remained valid.","simplicity":"One migration and one test-fixture migration-list entry; no runtime architecture change."}}
{"run":7,"commit":"db7feb5","metric":43.876,"metrics":{"complete_ms":43.876,"critical_bytes":265361,"data_regressions":0,"harnesses_ms":3.473,"harnesses_bytes":62,"activity_ms":17.724,"activity_bytes":34040,"work_rhythm_ms":24.899,"work_rhythm_bytes":208764,"session_shape_ms":8.557,"session_shape_bytes":1157,"usage_ms":26.522,"usage_bytes":17466,"cache_misses_ms":34.746,"cache_misses_bytes":3872,"activity_root_rollups_ms":0.6,"activity_cache_misses_ms":2.1,"activity_aggregate_ms":0.5,"work_rhythm_root_rollups_ms":0.5,"work_rhythm_root_execution_intervals_ms":5.1,"work_rhythm_aggregate_ms":4.1},"status":"discard","description":"Repeat the covering-index candidate to separate its gain from request-order noise.","timestamp":1788382700105,"segment":1,"confidence":2.245117187500009,"asi":{"hypothesis":"Repeating the kept index with no code change will show whether the 11% primary gain survives benchmark noise.","rollback_reason":"The repeat was 43.9 ms, above the candidate's 37.2 ms and baseline comparison; response checks passed, so this is timing variance rather than evidence against the index.","next_action_hint":"Keep the index, use more stable endpoint-level diagnostics, and test a structurally different request-scheduling or work-rhythm split."}}
{"run":8,"commit":"be7a266","metric":35.391,"metrics":{"complete_ms":35.391,"critical_bytes":265361,"data_regressions":0,"harnesses_ms":21.017,"harnesses_bytes":62,"activity_ms":34.532,"activity_bytes":34040,"work_rhythm_ms":25.01,"work_rhythm_bytes":208764,"session_shape_ms":4.277,"session_shape_bytes":1157,"usage_ms":13.926,"usage_bytes":17466,"cache_misses_ms":29.589,"cache_misses_bytes":3872,"activity_root_rollups_ms":0.6,"activity_cache_misses_ms":2,"activity_aggregate_ms":0.7,"work_rhythm_root_rollups_ms":0.7,"work_rhythm_root_execution_intervals_ms":4.9,"work_rhythm_aggregate_ms":4.1},"status":"keep","description":"Add a covering conversation-call index for the subagent usage rollup query.","timestamp":1788382848416,"segment":1,"confidence":2,"asi":{"hypothesis":"The usage endpoint's recursive subagent query scans all model calls because it lacks a covering conversation-oriented index; covering its join, date/filter, token, and cost columns should cut that scan.","observations":"The isolated subagent query improved from about 3.4 ms to 2.2 ms and the concurrent critical median improved to 35.39 ms from the 41.83 ms stable baseline; usage response latency fell to 13.93 ms. SQLite chose the covering index for the call scan.","data_guard":"All guarded non-rhythm responses matched and response byte counts were unchanged.","simplicity":"One migration plus the existing test-fixture migration-list entry; the index is write overhead but avoids a runtime query rewrite."}}
{"type":"config","name":"Initial dashboard responsiveness with deferred work-rhythm calendar","metricName":"critical_ms","metricUnit":"ms","bestDirection":"lower"}
{"run":9,"commit":"f4fbae4","metric":32.812,"metrics":{"complete_ms":46.037,"critical_bytes":129636,"complete_bytes":265412,"data_regressions":0,"harnesses_ms":10.316,"harnesses_bytes":62,"activity_ms":24.603,"activity_bytes":34040,"work_rhythm_ms":31.197,"work_rhythm_bytes":73039,"session_shape_ms":3.063,"session_shape_bytes":1157,"usage_ms":17.774,"usage_bytes":17466,"cache_misses_ms":19.67,"cache_misses_bytes":3872,"work_rhythm_days_ms":19.701,"work_rhythm_days_bytes":135776,"activity_root_rollups_ms":0.6,"activity_cache_misses_ms":2.1,"activity_aggregate_ms":0.9,"work_rhythm_root_rollups_ms":0.6,"work_rhythm_root_execution_intervals_ms":4.7,"work_rhythm_work_rhythm_ms":1.5,"work_rhythm_session_diagnostics_ms":0.5,"work_rhythm_aggregate_ms":1.9,"work_rhythm_days_root_rollups_ms":0.6,"work_rhythm_days_root_execution_intervals_ms":4.7,"work_rhythm_days_work_rhythm_days_ms":3.8,"work_rhythm_days_aggregate_ms":3.9},"status":"keep","description":"Baseline the split work-rhythm contract with critical summary data and deferred calendar details.","timestamp":1788383363214,"segment":2,"confidence":null,"asi":{"hypothesis":"A lightweight summary endpoint can render the work-rhythm overview before the large per-day calendar/timeline payload is fetched, making the initial critical path responsive while retaining all details.","observations":"The split benchmark critical median is 32.81 ms with 129.6 KB of critical responses, versus the prior all-data baseline of 35.39 ms and 265.4 KB; summary aggregation fell to about 1.9 ms. The deferred calendar adds about 13 ms to complete data and is 135.8 KB.","comparison_limit":"This re-initialized benchmark measures perceived critical readiness, so its primary is not directly comparable to the prior all-concurrent metric; complete time is the comparable tradeoff signal.","data_guard":"All guarded non-rhythm responses matched. Work-rhythm summary and days are intentionally exempt because the calendar contract was split.","simplicity":"Adds a narrow summary/days contract and one dependent request; no worker pool or general cache."}}
{"run":10,"commit":"621a025","metric":31.235,"metrics":{"complete_ms":44.781,"critical_bytes":129636,"complete_bytes":265412,"data_regressions":0,"harnesses_ms":6.319,"harnesses_bytes":62,"activity_ms":5.866,"activity_bytes":34040,"work_rhythm_ms":20.784,"work_rhythm_bytes":73039,"session_shape_ms":17.476,"session_shape_bytes":1157,"usage_ms":20.001,"usage_bytes":17466,"cache_misses_ms":30.106,"cache_misses_bytes":3872,"work_rhythm_days_ms":23.442,"work_rhythm_days_bytes":135776,"activity_root_rollups_ms":0.6,"activity_cache_misses_ms":2,"activity_aggregate_ms":0.6,"work_rhythm_root_rollups_ms":0.5,"work_rhythm_root_execution_intervals_ms":4.3,"work_rhythm_work_rhythm_ms":1.4,"work_rhythm_session_diagnostics_ms":0.3,"work_rhythm_aggregate_ms":1.7,"work_rhythm_days_root_rollups_ms":0.6,"work_rhythm_days_root_execution_intervals_ms":4.1,"work_rhythm_days_work_rhythm_days_ms":3.5,"work_rhythm_days_aggregate_ms":3.5},"status":"keep","description":"Add a covering index for turn execution timestamps used by root work-rhythm interval loading.","timestamp":1788383468289,"segment":2,"confidence":null,"asi":{"hypothesis":"Covering the turn join and execution timestamps should remove table lookups from the root interval query, complementing the kept tool-event covering index.","observations":"The isolated query fell from about 3.29 ms to 2.87 ms. In the first split-path run critical_ms was 31.235 and the root execution phase was 4.3 ms; complete_ms also improved versus the split baseline.","data_guard":"All guarded non-rhythm responses matched and response sizes were stable.","simplicity":"One narrow migration/index; retain only if confirmation shows the small gain is useful."}}
{"run":11,"commit":"356d4b9","metric":30.58,"metrics":{"complete_ms":42.547,"critical_bytes":129636,"complete_bytes":265412,"data_regressions":0,"harnesses_ms":6.078,"harnesses_bytes":62,"activity_ms":5.712,"activity_bytes":34040,"work_rhythm_ms":19.803,"work_rhythm_bytes":73039,"session_shape_ms":16.395,"session_shape_bytes":1157,"usage_ms":21.113,"usage_bytes":17466,"cache_misses_ms":28.891,"cache_misses_bytes":3872,"work_rhythm_days_ms":21.13,"work_rhythm_days_bytes":135776,"activity_root_rollups_ms":0.5,"activity_cache_misses_ms":2,"activity_aggregate_ms":0.5,"work_rhythm_root_rollups_ms":0.4,"work_rhythm_root_execution_intervals_ms":4.1,"work_rhythm_work_rhythm_ms":1.1,"work_rhythm_session_diagnostics_ms":0.2,"work_rhythm_aggregate_ms":1.4,"work_rhythm_days_root_rollups_ms":0.5,"work_rhythm_days_root_execution_intervals_ms":4.2,"work_rhythm_days_work_rhythm_days_ms":2.9,"work_rhythm_days_aggregate_ms":2.9},"status":"keep","description":"Confirm the turn-execution covering index with seven samples on the stable split workload.","timestamp":1788383484008,"segment":2,"confidence":3.4076335877862527,"asi":{"hypothesis":"A seven-sample repeat should distinguish the turn index's small isolated query gain from concurrent request-order noise.","observations":"The confirmation median was 30.58 ms critical and 42.55 ms complete, below the split baseline of 32.81/46.04; root execution was about 4.1 ms. This supports retaining the index, while endpoint medians remain noisy.","data_guard":"All guarded non-rhythm responses matched.","simplicity":"No additional code beyond the single index migration."}}
{"run":12,"commit":"282d080","metric":30.168,"metrics":{"complete_ms":40.897,"critical_bytes":129636,"complete_bytes":265412,"data_regressions":0,"harnesses_ms":6.482,"harnesses_bytes":62,"activity_ms":16.325,"activity_bytes":34040,"work_rhythm_ms":24.699,"work_rhythm_bytes":73039,"session_shape_ms":24.914,"session_shape_bytes":1157,"usage_ms":22.421,"usage_bytes":17466,"cache_misses_ms":14.704,"cache_misses_bytes":3872,"work_rhythm_days_ms":12.437,"work_rhythm_days_bytes":135776,"activity_root_rollups_ms":0.5,"activity_cache_misses_ms":1.9,"activity_aggregate_ms":0.8,"work_rhythm_root_rollups_ms":0.5,"work_rhythm_root_execution_intervals_ms":4.2,"work_rhythm_work_rhythm_ms":1.3,"work_rhythm_session_diagnostics_ms":0.2,"work_rhythm_aggregate_ms":1.7,"work_rhythm_days_root_rollups_ms":0.4,"work_rhythm_days_root_execution_intervals_ms":4,"work_rhythm_days_work_rhythm_days_ms":2.8,"work_rhythm_days_aggregate_ms":2.8},"status":"keep","description":"Remove an unnecessary inner ordering step from root work-rhythm interval aggregation.","timestamp":1788383563926,"segment":2,"confidence":4.955951265229612,"asi":{"hypothesis":"Work-rhythm re-sorts execution intervals before estimation, so the SQL subquery's temporary chronological ORDER BY is unnecessary and can be removed.","observations":"The query plan no longer creates the inner ORDER BY temporary B-tree; critical_ms was 30.17 ms and complete_ms 40.90 ms, a small improvement over 30.58/42.55 with the same indexes.","data_guard":"All guarded non-rhythm responses matched; work-rhythm summary/day schemas and sizes remained valid.","simplicity":"Deletes one SQL ordering clause with no new moving part."}}
{"type":"config","name":"Core dashboard responsiveness with deferred secondary sections","metricName":"critical_ms","metricUnit":"ms","bestDirection":"lower"}
{"run":13,"commit":"8fab684","metric":16.916,"metrics":{"complete_ms":46.197,"critical_bytes":107141,"complete_bytes":265412,"data_regressions":0,"harnesses_ms":2.781,"harnesses_bytes":62,"activity_ms":7.467,"activity_bytes":34040,"work_rhythm_ms":15.726,"work_rhythm_bytes":73039,"work_rhythm_days_ms":11.557,"work_rhythm_days_bytes":135776,"session_shape_ms":13.084,"session_shape_bytes":1157,"usage_ms":28.329,"usage_bytes":17466,"cache_misses_ms":22.697,"cache_misses_bytes":3872,"activity_root_rollups_ms":0.7,"activity_cache_misses_ms":2.2,"activity_aggregate_ms":0.9,"work_rhythm_root_rollups_ms":0.6,"work_rhythm_root_execution_intervals_ms":4.5,"work_rhythm_work_rhythm_ms":1.6,"work_rhythm_session_diagnostics_ms":0.3,"work_rhythm_aggregate_ms":1.9,"work_rhythm_days_root_rollups_ms":0.5,"work_rhythm_days_root_execution_intervals_ms":4.2,"work_rhythm_days_work_rhythm_days_ms":3.6,"work_rhythm_days_aggregate_ms":3.6},"status":"keep","description":"Baseline the core-first dashboard schedule with secondary sections deferred until activity and work-rhythm settle.","timestamp":1788383728481,"segment":3,"confidence":null,"asi":{"hypothesis":"Do not let below-the-fold session shape, usage tooltip data, and cache-miss queries contend with the activity/work-rhythm requests that establish the visible dashboard; enable them after both core responses settle.","observations":"Under the updated phase workload, critical_ms is 16.92 ms and critical bytes are 107.1 KB; complete_ms is 46.20 ms because secondary requests now run after core readiness. Compared with the prior split-path all-request metric (30.17 ms), this favors perceived first readiness at the cost of deferred completion.","data_guard":"All guarded responses, including usage and cache misses, matched their stable references; no feature data was removed.","simplicity":"Adds one boolean gate propagated to two existing data components and one Promise.all settlement; no timers, observers, or new dependencies."}}
