{"run":37,"commit":"f389108","metric":11.353,"metrics":{"complete_ms":32.257,"critical_bytes":37891,"complete_bytes":265412,"data_regressions":0,"harnesses_ms":10.817,"harnesses_bytes":62,"activity_ms":10.232,"activity_bytes":34040,"work_rhythm_ms":10.95,"work_rhythm_bytes":3789,"work_rhythm_days_ms":5.674,"work_rhythm_days_bytes":205026,"session_shape_ms":7.507,"session_shape_bytes":1157,"usage_ms":19.98,"usage_bytes":17466,"cache_misses_ms":19.726,"cache_misses_bytes":3872,"activity_root_rollups_ms":0.6,"activity_root_execution_intervals_ms":3.9,"activity_cache_misses_ms":2,"activity_aggregate_ms":0.6,"work_rhythm_root_rollups_ms":0,"work_rhythm_root_execution_intervals_ms":0,"work_rhythm_work_rhythm_ms":1.2,"work_rhythm_session_diagnostics_ms":0,"work_rhythm_aggregate_ms":1.2,"work_rhythm_days_root_rollups_ms":0,"work_rhythm_days_root_execution_intervals_ms":0,"work_rhythm_days_work_rhythm_days_ms":0,"work_rhythm_days_work_rhythm_ms":3,"work_rhythm_days_session_diagnostics_ms":0.2,"work_rhythm_days_aggregate_ms":3.2},"status":"discard","description":"Run PRAGMA optimize during archive connection setup; the query plan hint did not beat the kept critical-path baseline.","timestamp":1788386218320,"segment":4,"confidence":null,"asi":{"hypothesis":"Running PRAGMA optimize once during connection setup may collect useful SQLite statistics for the indexed dashboard queries without changing request-time work.","observations":"The candidate measured 11.353 ms critical and 32.257 ms complete, with no data regressions. Complete time and the activity root-interval phase were lower than the fresh-server repeat, but critical_ms did not beat the kept 11.073 ms baseline.","rollback_reason":"The primary metric was worse than the kept baseline, and the isolated improvement was within concurrent timing noise; retaining a startup pragma without a demonstrated critical-path gain is not justified.","next_action_hint":"Do not retain PRAGMA optimize; the remaining backlog requires a larger persisted root-interval or worker-thread experiment rather than another connection pragma."}}
{"run":38,"commit":"0adaa54","metric":8.281,"metrics":{"complete_ms":31.431,"critical_bytes":37891,"complete_bytes":265412,"data_regressions":0,"harnesses_ms":1.527,"harnesses_bytes":62,"activity_ms":6.766,"activity_bytes":34040,"work_rhythm_ms":7.863,"work_rhythm_bytes":3789,"work_rhythm_days_ms":6.357,"work_rhythm_days_bytes":205026,"session_shape_ms":17.336,"session_shape_bytes":1157,"usage_ms":22.34,"usage_bytes":17466,"cache_misses_ms":17.62,"cache_misses_bytes":3872,"activity_root_rollups_ms":0.7,"activity_root_execution_intervals_ms":0,"activity_cache_misses_ms":2.2,"activity_aggregate_ms":0.8,"work_rhythm_root_rollups_ms":0,"work_rhythm_root_execution_intervals_ms":0,"work_rhythm_work_rhythm_ms":1.4,"work_rhythm_session_diagnostics_ms":0,"work_rhythm_aggregate_ms":1.4,"work_rhythm_days_root_rollups_ms":0,"work_rhythm_days_root_execution_intervals_ms":0,"work_rhythm_days_work_rhythm_days_ms":0,"work_rhythm_days_work_rhythm_ms":3.5,"work_rhythm_days_session_diagnostics_ms":0.2,"work_rhythm_days_aggregate_ms":3.7},"status":"keep","description":"Persist root execution intervals in conversation rollups to remove the request-time interval aggregation query.","timestamp":1788386519033,"segment":4,"confidence":3.8194254445964435,"asi":{"hypothesis":"Persisting each conversation's root execution intervals beside its existing overview rollup should replace the measured request-time turn/tool join and JSON aggregation with a column read, while retaining a fallback for precomputed-null rows.","observations":"The migration backfill matched the existing interval query for all 958 selected roots; one additional empty root correctly persists an empty array. The benchmark measured 8.281 ms critical and 31.431 ms complete versus the 11.073 ms kept critical baseline, with root-execution phases absent and all guarded responses unchanged.","data_guard":"The benchmark reported zero data regressions; activity, session shape, usage, cache-miss, and harness responses matched their references. Work-rhythm summary/days remained schema-valid and its intentional equality exemption was unchanged.","simplicity":"Adds one derived rollup column, one backfill migration, write-path population, and a compatibility fallback; it removes only the request-time interval query when data is populated."}}
{"run":39,"commit":"9841800","metric":7.934,"metrics":{"complete_ms":30.152,"critical_bytes":37891,"complete_bytes":265412,"data_regressions":0,"harnesses_ms":1.769,"harnesses_bytes":62,"activity_ms":6.388,"activity_bytes":34040,"work_rhythm_ms":7.517,"work_rhythm_bytes":3789,"work_rhythm_days_ms":15.69,"work_rhythm_days_bytes":205026,"session_shape_ms":13.354,"session_shape_bytes":1157,"usage_ms":15.332,"usage_bytes":17466,"cache_misses_ms":19.544,"cache_misses_bytes":3872,"activity_root_rollups_ms":0.6,"activity_root_execution_intervals_ms":0,"activity_cache_misses_ms":2.1,"activity_aggregate_ms":0.7,"work_rhythm_root_rollups_ms":0,"work_rhythm_root_execution_intervals_ms":0,"work_rhythm_work_rhythm_ms":1.3,"work_rhythm_session_diagnostics_ms":0,"work_rhythm_aggregate_ms":1.3,"work_rhythm_days_root_rollups_ms":0,"work_rhythm_days_root_execution_intervals_ms":0,"work_rhythm_days_work_rhythm_days_ms":0,"work_rhythm_days_work_rhythm_ms":3,"work_rhythm_days_session_diagnostics_ms":0.2,"work_rhythm_days_aggregate_ms":3.4},"status":"keep","description":"Confirm persisted root execution intervals with seven benchmark samples.","timestamp":1788386545279,"segment":4,"confidence":3.889714993804216,"asi":{"hypothesis":"A seven-sample repeat should confirm that removing the request-time root interval query is a real critical-path improvement rather than a favorable five-sample request order.","observations":"The seven-sample median was 7.934 ms critical and 30.152 ms complete, improving on the candidate's 8.281/31.431 ms. Root-execution phases remained absent and all response guards passed.","data_guard":"Zero data regressions; guarded endpoints matched references and response sizes were unchanged.","simplicity":"No implementation changes from the persisted rollup candidate.","next_action_hint":"Treat persisted root intervals as confirmed and investigate the remaining activity cache-miss/rollup work or the worker-thread alternative only if a new bottleneck measurement justifies it."}}
{"run":40,"commit":"9841800","metric":7.861,"metrics":{"complete_ms":30.938,"critical_bytes":37891,"complete_bytes":265412,"data_regressions":0,"harnesses_ms":4.256,"harnesses_bytes":62,"activity_ms":6.36,"activity_bytes":34040,"work_rhythm_ms":7.004,"work_rhythm_bytes":3789,"work_rhythm_days_ms":10.357,"work_rhythm_days_bytes":205026,"session_shape_ms":13.226,"session_shape_bytes":1157,"usage_ms":21.833,"usage_bytes":17466,"cache_misses_ms":20.68,"cache_misses_bytes":3872,"activity_root_rollups_ms":0.6,"activity_root_execution_intervals_ms":0,"activity_cache_misses_ms":2.2,"activity_aggregate_ms":0.7,"work_rhythm_root_rollups_ms":0,"work_rhythm_root_execution_intervals_ms":0,"work_rhythm_work_rhythm_ms":1.2,"work_rhythm_session_diagnostics_ms":0,"work_rhythm_aggregate_ms":1.2,"work_rhythm_days_root_rollups_ms":0,"work_rhythm_days_root_execution_intervals_ms":0,"work_rhythm_days_work_rhythm_days_ms":0,"work_rhythm_days_work_rhythm_ms":3.1,"work_rhythm_days_session_diagnostics_ms":0.2,"work_rhythm_days_aggregate_ms":3.3},"status":"discard","description":"Add a conversation-title covering index; SQLite did not select it for the root-rollup query and the timing change was within noise.","timestamp":1788386623532,"segment":4,"confidence":3.0714285714285707,"asi":{"hypothesis":"A covering index on conversation_branches(conversation_id, updated_at, id, source_session_id) could remove the title subquery's temporary sort during root-rollup hydration.","observations":"The query plan continued using sqlite_autoindex_conversation_branches_1 and a temporary B-tree for the title subquery. The five-sample median was 7.861 ms critical versus 7.934 ms for the seven-sample persisted-rollup confirmation, a difference too small to attribute to the unused index; guards passed.","rollback_reason":"The candidate added write/index overhead without a demonstrated query-plan or primary-metric benefit.","next_action_hint":"Do not retain the title index; keep the persisted root interval rollup and stop pursuing sub-millisecond title-query variants."}}
{"run":41,"commit":"b3f5cad","metric":7.19,"metrics":{"complete_ms":26.642,"critical_bytes":37891,"complete_bytes":265412,"data_regressions":0,"harnesses_ms":1.661,"harnesses_bytes":62,"activity_ms":5.778,"activity_bytes":34040,"work_rhythm_ms":6.293,"work_rhythm_bytes":3789,"work_rhythm_days_ms":13.547,"work_rhythm_days_bytes":205026,"session_shape_ms":19.007,"session_shape_bytes":1157,"usage_ms":18.03,"usage_bytes":17466,"cache_misses_ms":9.852,"cache_misses_bytes":3872,"activity_root_rollups_ms":0,"activity_root_execution_intervals_ms":0,"activity_cache_misses_ms":1.9,"activity_aggregate_ms":0.6,"work_rhythm_root_rollups_ms":0,"work_rhythm_root_execution_intervals_ms":0,"work_rhythm_work_rhythm_ms":1.3,"work_rhythm_session_diagnostics_ms":0,"work_rhythm_aggregate_ms":1.3,"work_rhythm_days_root_rollups_ms":0,"work_rhythm_days_root_execution_intervals_ms":0,"work_rhythm_days_work_rhythm_days_ms":0,"work_rhythm_days_work_rhythm_ms":3,"work_rhythm_days_session_diagnostics_ms":0.2,"work_rhythm_days_aggregate_ms":3.3},"status":"keep","description":"Force the title subquery onto its ordering covering index after confirming it removes the temporary sort.","timestamp":1788386712742,"segment":4,"confidence":3.3259100642398276,"asi":{"hypothesis":"The title lookup's existing ordering covering index is safe to force because it matches conversation_id plus updated_at/id ordering and includes source_session_id; this should remove one temporary B-tree per root-rollup query.","observations":"EXPLAIN QUERY PLAN switched the title lookup to the covering index and removed its temporary sort. The benchmark measured 7.190 ms critical and 26.642 ms complete versus 7.934/30.152 for the persisted-rollup confirmation; all response guards passed.","data_guard":"Zero data regressions; guarded response bytes and JSON matched references. The title fallback semantics remain unchanged because the index preserves the same ORDER BY.","simplicity":"Adds one narrow additive index and one INDEXED BY clause; no response or request contract changes."}}
{"run":42,"commit":"3ed783f","metric":6.569,"metrics":{"complete_ms":34.098,"critical_bytes":37891,"complete_bytes":265412,"data_regressions":0,"harnesses_ms":1.441,"harnesses_bytes":62,"activity_ms":4.851,"activity_bytes":34040,"work_rhythm_ms":6.058,"work_rhythm_bytes":3789,"work_rhythm_days_ms":21.559,"work_rhythm_days_bytes":205026,"session_shape_ms":27.127,"session_shape_bytes":1157,"usage_ms":23.263,"usage_bytes":17466,"cache_misses_ms":13.788,"cache_misses_bytes":3872,"activity_root_rollups_ms":0,"activity_root_execution_intervals_ms":0,"activity_cache_misses_ms":2.2,"activity_aggregate_ms":0.6,"work_rhythm_root_rollups_ms":0,"work_rhythm_root_execution_intervals_ms":0,"work_rhythm_work_rhythm_ms":1.3,"work_rhythm_session_diagnostics_ms":0,"work_rhythm_aggregate_ms":1.3,"work_rhythm_days_root_rollups_ms":0.5,"work_rhythm_days_root_execution_intervals_ms":0,"work_rhythm_days_work_rhythm_days_ms":0,"work_rhythm_days_work_rhythm_ms":3.3,"work_rhythm_days_session_diagnostics_ms":0.2,"work_rhythm_days_aggregate_ms":3.5},"status":"keep","description":"Confirm the forced title-index lookup with seven benchmark samples.","timestamp":1788386729669,"segment":4,"confidence":3.4303122619954336,"asi":{"hypothesis":"The forced title-index query should consistently avoid the per-root temporary sort after the first candidate's query plan confirmed the intended covering-index path.","observations":"The seven-sample median was 6.569 ms critical and 34.098 ms complete, below the candidate's 7.190 ms critical result. The plan remains covered, and all response guards passed; complete time varied independently because deferred days were slower.","data_guard":"Zero data regressions and unchanged guarded response sizes.","simplicity":"No implementation changes from the forced-index candidate.","next_action_hint":"Retain the title index/query shape and avoid further title-query variants; measure only larger remaining work."}}
{"run":43,"commit":"5f2f055","metric":5.954,"metrics":{"complete_ms":27.043,"critical_bytes":37891,"complete_bytes":265412,"data_regressions":0,"harnesses_ms":1.171,"harnesses_bytes":62,"activity_ms":4.24,"activity_bytes":34040,"work_rhythm_ms":5.609,"work_rhythm_bytes":3789,"work_rhythm_days_ms":12.251,"work_rhythm_days_bytes":205026,"session_shape_ms":18.976,"session_shape_bytes":1157,"usage_ms":18.107,"usage_bytes":17466,"cache_misses_ms":15.823,"cache_misses_bytes":3872,"activity_root_rollups_ms":0.5,"activity_root_execution_intervals_ms":0,"activity_cache_misses_ms":1,"activity_aggregate_ms":0.7,"work_rhythm_root_rollups_ms":0,"work_rhythm_root_execution_intervals_ms":0,"work_rhythm_work_rhythm_ms":1.3,"work_rhythm_session_diagnostics_ms":0,"work_rhythm_aggregate_ms":1.3,"work_rhythm_days_root_rollups_ms":0,"work_rhythm_days_root_execution_intervals_ms":0,"work_rhythm_days_work_rhythm_days_ms":0,"work_rhythm_days_work_rhythm_ms":3.2,"work_rhythm_days_session_diagnostics_ms":0.2,"work_rhythm_days_aggregate_ms":3.5},"status":"keep","description":"Restrict the cache-miss recursion to roots already in the requested activity range.","timestamp":1788386812578,"segment":4,"confidence":3.661659513590848,"asi":{"hypothesis":"The cache-miss summary already filters roots by started/updated time after constructing the full recursive tree, so applying the same root range predicate to the tree seed should avoid traversing irrelevant historical trees without changing scoped rows.","observations":"The five-sample median was 5.954 ms critical and 27.043 ms complete versus 6.569/34.098 ms for the forced-title-index candidate. The activity cache-miss phase fell to 1.0 ms, and all response guards passed.","data_guard":"Zero data regressions; activity and cache-miss responses remained byte-identical to their references. Root filtering is equivalent to the existing scoped root predicate.","simplicity":"One recursive-query predicate and one additional bound parameter; no schema or response change."}}
{"run":44,"commit":"5f2f055","metric":6.592,"metrics":{"complete_ms":28.491,"critical_bytes":37891,"complete_bytes":265412,"data_regressions":0,"harnesses_ms":1.233,"harnesses_bytes":62,"activity_ms":4.849,"activity_bytes":34040,"work_rhythm_ms":6.122,"work_rhythm_bytes":3789,"work_rhythm_days_ms":15.281,"work_rhythm_days_bytes":205026,"session_shape_ms":12.932,"session_shape_bytes":1157,"usage_ms":18.624,"usage_bytes":17466,"cache_misses_ms":15.281,"cache_misses_bytes":3872,"activity_root_rollups_ms":0.6,"activity_root_execution_intervals_ms":0,"activity_cache_misses_ms":1,"activity_aggregate_ms":0.5,"work_rhythm_root_rollups_ms":0,"work_rhythm_root_execution_intervals_ms":0,"work_rhythm_work_rhythm_ms":1.2,"work_rhythm_session_diagnostics_ms":0,"work_rhythm_aggregate_ms":1.2,"work_rhythm_days_root_rollups_ms":0,"work_rhythm_days_root_execution_intervals_ms":0,"work_rhythm_days_work_rhythm_days_ms":0,"work_rhythm_days_work_rhythm_ms":2.8,"work_rhythm_days_session_diagnostics_ms":0.2,"work_rhythm_days_aggregate_ms":3},"status":"discard","description":"Repeat the range-restricted cache-miss recursion with seven samples; the candidate remained semantically safe but this sample did not beat its best median.","timestamp":1788386830177,"segment":4,"confidence":3.4517869184086303,"asi":{"hypothesis":"A seven-sample confirmation should show whether limiting the recursive cache-miss tree to in-range roots consistently reduces the activity cache-miss phase.","observations":"The confirmation median was 6.592 ms critical and 28.491 ms complete versus the candidate's 5.954/27.043 ms. The activity cache-miss phase stayed at 1.0 ms and all guards passed, supporting the query's phase-level benefit despite request-order noise.","rollback_reason":"The no-change confirmation did not improve the candidate's primary median; the candidate itself remains in place because this run changed no source code.","next_action_hint":"Retain the range predicate, but stop tuning this query unless a different structural bottleneck is identified."}}
{"run":45,"commit":"3ed783f","metric":6.4,"metrics":{"complete_ms":33.252,"critical_bytes":37891,"complete_bytes":265412,"data_regressions":0,"harnesses_ms":5.153,"harnesses_bytes":62,"activity_ms":4.48,"activity_bytes":34040,"work_rhythm_ms":6.065,"work_rhythm_bytes":3789,"work_rhythm_days_ms":7.066,"work_rhythm_days_bytes":205026,"session_shape_ms":10.627,"session_shape_bytes":1157,"usage_ms":19.257,"usage_bytes":17466,"cache_misses_ms":23.855,"cache_misses_bytes":3872,"activity_root_rollups_ms":0.6,"activity_root_execution_intervals_ms":0,"activity_cache_misses_ms":0.9,"activity_aggregate_ms":0.7,"work_rhythm_root_rollups_ms":0,"work_rhythm_root_execution_intervals_ms":0,"work_rhythm_work_rhythm_ms":1.4,"work_rhythm_session_diagnostics_ms":0,"work_rhythm_aggregate_ms":1.4,"work_rhythm_days_root_rollups_ms":0,"work_rhythm_days_root_execution_intervals_ms":0,"work_rhythm_days_work_rhythm_days_ms":0,"work_rhythm_days_work_rhythm_ms":3.5,"work_rhythm_days_session_diagnostics_ms":0.2,"work_rhythm_days_aggregate_ms":3.7},"status":"discard","description":"Add an expression index for in-range cache-miss root selection; the plan used it but the representative critical path did not improve.","timestamp":1788389634097,"segment":4,"confidence":3.181479179614666,"asi":{"hypothesis":"An expression index on COALESCE(conversations.started_at, conversations.updated_at) could make the range-restricted recursive cache-miss tree seed seek directly to relevant roots.","observations":"EXPLAIN QUERY PLAN used the new covering expression index, but the five-sample median was 6.400 ms critical and 33.252 ms complete versus the kept range-predicate result of 5.954/27.043 ms. The activity cache-miss phase was 0.9 ms and guards passed.","rollback_reason":"The indexed seed did not beat the kept primary result; the small phase reduction did not offset request-order variance or show a representative critical-path gain.","next_action_hint":"Remove this index and stop optimizing the already sub-millisecond root-seed scan; remaining work is not large enough to justify another index."}}
{"run":46,"commit":"5f2f055","metric":7.278,"metrics":{"complete_ms":29.87,"critical_bytes":37891,"complete_bytes":265412,"data_regressions":0,"harnesses_ms":5.648,"harnesses_bytes":62,"activity_ms":5.919,"activity_bytes":34040,"work_rhythm_ms":6.099,"work_rhythm_bytes":3789,"work_rhythm_days_ms":13.555,"work_rhythm_days_bytes":205026,"session_shape_ms":16.329,"session_shape_bytes":1157,"usage_ms":19.942,"usage_bytes":17466,"cache_misses_ms":13.196,"cache_misses_bytes":3872,"activity_root_rollups_ms":0.7,"activity_root_execution_intervals_ms":0,"activity_cache_misses_ms":1,"activity_aggregate_ms":0.6,"work_rhythm_root_rollups_ms":0,"work_rhythm_root_execution_intervals_ms":0,"work_rhythm_work_rhythm_ms":1.2,"work_rhythm_session_diagnostics_ms":0,"work_rhythm_aggregate_ms":1.2,"work_rhythm_days_root_rollups_ms":0,"work_rhythm_days_root_execution_intervals_ms":0,"work_rhythm_days_work_rhythm_days_ms":0,"work_rhythm_days_work_rhythm_ms":3.3,"work_rhythm_days_session_diagnostics_ms":0.2,"work_rhythm_days_aggregate_ms":3.5},"status":"discard","description":"Run an eleven-sample confirmation of the current persisted-rollup and query-shape implementation.","timestamp":1788389656625,"segment":4,"confidence":2.950432276657062,"asi":{"hypothesis":"An eleven-sample run should characterize the current implementation after persisted root intervals, the forced title index, and the range-restricted cache-miss tree were kept.","observations":"The eleven-sample median was 7.278 ms critical and 29.870 ms complete, above the best 5.954 ms candidate result but with the activity cache-miss phase still at 1.0 ms and all guards passing. The wide endpoint variance confirms the concurrent workload remains noisy.","rollback_reason":"This no-change confirmation did not improve the current kept candidate; no source changes were made or reverted.","next_action_hint":"Retain the current implementation and avoid claiming the 5.954 ms sample as a stable absolute; only pursue a materially different worker-thread or persisted aggregate experiment."}}
