{"run":25,"commit":"7fb74cd","metric":11.221,"metrics":{"complete_ms":34.42,"critical_bytes":37891,"complete_bytes":265412,"data_regressions":0,"harnesses_ms":1.453,"harnesses_bytes":62,"activity_ms":6.409,"activity_bytes":34040,"work_rhythm_ms":10.883,"work_rhythm_bytes":3789,"work_rhythm_days_ms":15.887,"work_rhythm_days_bytes":205026,"session_shape_ms":11.822,"session_shape_bytes":1157,"usage_ms":21.852,"usage_bytes":17466,"cache_misses_ms":20.662,"cache_misses_bytes":3872,"activity_root_rollups_ms":0,"activity_root_execution_intervals_ms":0,"activity_cache_misses_ms":2.1,"activity_aggregate_ms":0.7,"work_rhythm_root_rollups_ms":0,"work_rhythm_root_execution_intervals_ms":0,"work_rhythm_work_rhythm_ms":1.3,"work_rhythm_session_diagnostics_ms":0,"work_rhythm_aggregate_ms":1.4,"work_rhythm_days_root_rollups_ms":0.5,"work_rhythm_days_root_execution_intervals_ms":3.9,"work_rhythm_days_work_rhythm_days_ms":0,"work_rhythm_days_work_rhythm_ms":3,"work_rhythm_days_session_diagnostics_ms":0.2,"work_rhythm_days_aggregate_ms":3.3},"status":"keep","description":"Validate the root-turn covering index against the benchmark snapshot after applying its migration.","timestamp":1788384919709,"segment":3,"confidence":7.695945945945944,"asi":{"hypothesis":"The turn covering index should reduce root interval loading once the benchmark database actually contains the migrated schema.","observations":"With the index present, critical_ms was 11.22 ms and complete_ms 34.42 ms; the days root-execution phase was 3.9 ms. This is a small improvement over the prior 11.50/35.52 result and confirms the migration is active.","data_guard":"All guarded responses matched.","simplicity":"The migration remains one additive covering index; the benchmark snapshot was updated only to exercise the committed schema change."}}
{"type":"config","name":"Core dashboard responsiveness with deferred secondary sections","metricName":"critical_ms","metricUnit":"ms","bestDirection":"lower"}
{"run":26,"commit":"cfde3e2","metric":11.073,"metrics":{"complete_ms":37.7,"critical_bytes":37891,"complete_bytes":265412,"data_regressions":0,"harnesses_ms":1.642,"harnesses_bytes":62,"activity_ms":9.341,"activity_bytes":34040,"work_rhythm_ms":10.705,"work_rhythm_bytes":3789,"work_rhythm_days_ms":12.544,"work_rhythm_days_bytes":205026,"session_shape_ms":8.996,"session_shape_bytes":1157,"usage_ms":17.674,"usage_bytes":17466,"cache_misses_ms":20.77,"cache_misses_bytes":3872,"activity_root_rollups_ms":0.5,"activity_root_execution_intervals_ms":3.8,"activity_cache_misses_ms":2,"activity_aggregate_ms":0.6,"work_rhythm_root_rollups_ms":0,"work_rhythm_root_execution_intervals_ms":0,"work_rhythm_work_rhythm_ms":1.5,"work_rhythm_session_diagnostics_ms":0,"work_rhythm_aggregate_ms":1.5,"work_rhythm_days_root_rollups_ms":0,"work_rhythm_days_root_execution_intervals_ms":0,"work_rhythm_days_work_rhythm_days_ms":0,"work_rhythm_days_session_diagnostics_ms":0.2,"work_rhythm_days_aggregate_ms":4.2},"status":"keep","description":"Baseline deferring calendar/details until both core responses settle.","timestamp":1788385027640,"segment":4,"confidence":null,"asi":{"hypothesis":"Starting calendar/detail work only after both activity and work-rhythm summary responses settle should prevent deferred synchronous SQLite work from delaying the remaining core request.","observations":"Under the new phase workload, the implementation baseline was 11.07 ms critical and 37.70 ms complete. The earlier summary-only dependency measured 11.22 ms critical and 34.42 ms complete, so this is a core-vs-complete tradeoff to test rather than a settled win.","data_guard":"All guarded responses matched.","simplicity":"Moves the existing days request into the existing core Promise.all settlement; no new API or timer."}}
{"run":27,"commit":"cfde3e2","metric":12.226,"metrics":{"complete_ms":37.701,"critical_bytes":37891,"complete_bytes":265412,"data_regressions":0,"harnesses_ms":1.739,"harnesses_bytes":62,"activity_ms":11.619,"activity_bytes":34040,"work_rhythm_ms":11.141,"work_rhythm_bytes":3789,"work_rhythm_days_ms":6.627,"work_rhythm_days_bytes":205026,"session_shape_ms":13.524,"session_shape_bytes":1157,"usage_ms":23.852,"usage_bytes":17466,"cache_misses_ms":21.176,"cache_misses_bytes":3872,"activity_root_rollups_ms":0.5,"activity_root_execution_intervals_ms":4.1,"activity_cache_misses_ms":2.3,"activity_aggregate_ms":0.8,"work_rhythm_root_rollups_ms":0,"work_rhythm_root_execution_intervals_ms":0,"work_rhythm_work_rhythm_ms":1.3,"work_rhythm_session_diagnostics_ms":0,"work_rhythm_aggregate_ms":1.3,"work_rhythm_days_root_rollups_ms":0,"work_rhythm_days_root_execution_intervals_ms":0,"work_rhythm_days_work_rhythm_days_ms":0,"work_rhythm_days_work_rhythm_ms":3,"work_rhythm_days_session_diagnostics_ms":0.2,"work_rhythm_days_aggregate_ms":3.4},"status":"discard","description":"Repeat the both-core settlement schedule; timing was noisier and did not beat its baseline.","timestamp":1788385053530,"segment":4,"confidence":null,"asi":{"hypothesis":"A repeat should confirm that deferring days until both core requests settle protects the critical response from queued SQLite work.","observations":"The repeat was 12.23 ms critical versus the 11.07 ms baseline; complete_ms was identical at 37.70 ms and all guards passed. The primary result is request-order noisy, but the dependency remains semantically safer.","rollback_reason":"This run did not improve the baseline; no code changes were made or reverted.","next_action_hint":"Retain the both-core dependency for event-loop isolation and stop tuning this scheduling boundary unless a larger sample shows a regression."}}
{"run":28,"commit":"cfde3e2","metric":14.025,"metrics":{"complete_ms":48.076,"critical_bytes":37891,"complete_bytes":265412,"data_regressions":0,"harnesses_ms":2.979,"harnesses_bytes":62,"activity_ms":12.433,"activity_bytes":34040,"work_rhythm_ms":13.608,"work_rhythm_bytes":3789,"work_rhythm_days_ms":9.205,"work_rhythm_days_bytes":205026,"session_shape_ms":22.256,"session_shape_bytes":1157,"usage_ms":27.453,"usage_bytes":17466,"cache_misses_ms":22.2,"cache_misses_bytes":3872,"activity_root_rollups_ms":0,"activity_root_execution_intervals_ms":0,"activity_cache_misses_ms":2.2,"activity_aggregate_ms":1.1,"work_rhythm_root_rollups_ms":0,"work_rhythm_root_execution_intervals_ms":0,"work_rhythm_work_rhythm_ms":1.4,"work_rhythm_session_diagnostics_ms":0,"work_rhythm_aggregate_ms":1.4,"work_rhythm_days_root_rollups_ms":0,"work_rhythm_days_root_execution_intervals_ms":0,"work_rhythm_days_work_rhythm_days_ms":0,"work_rhythm_days_work_rhythm_ms":4,"work_rhythm_days_session_diagnostics_ms":0.2,"work_rhythm_days_aggregate_ms":4.3},"status":"discard","description":"Force SQLite temporary structures into memory; the representative concurrent workload became slower.","timestamp":1788385185817,"segment":4,"confidence":null,"asi":{"hypothesis":"PRAGMA temp_store=MEMORY might reduce temporary B-tree overhead in grouped work-rhythm queries.","observations":"The candidate measured 14.03 ms critical and 48.08 ms complete versus 11.07/37.70; no response regressions occurred.","rollback_reason":"The pragma degraded both primary and complete timings on the stable snapshot.","next_action_hint":"Leave SQLite temporary storage at its default; the current indexes and short-lived rollup cache are better."}}
{"run":29,"commit":"cfde3e2","metric":11.665,"metrics":{"complete_ms":36.236,"critical_bytes":37891,"complete_bytes":265412,"data_regressions":0,"harnesses_ms":1.534,"harnesses_bytes":62,"activity_ms":10.49,"activity_bytes":34040,"work_rhythm_ms":11.305,"work_rhythm_bytes":3789,"work_rhythm_days_ms":8.75,"work_rhythm_days_bytes":205026,"session_shape_ms":17.557,"session_shape_bytes":1157,"usage_ms":17.359,"usage_bytes":17466,"cache_misses_ms":20.905,"cache_misses_bytes":3872,"activity_root_rollups_ms":0.4,"activity_root_execution_intervals_ms":3.9,"activity_cache_misses_ms":2.1,"activity_aggregate_ms":0.7,"work_rhythm_root_rollups_ms":0,"work_rhythm_root_execution_intervals_ms":0,"work_rhythm_work_rhythm_ms":1.2,"work_rhythm_session_diagnostics_ms":0,"work_rhythm_aggregate_ms":1.2,"work_rhythm_days_root_rollups_ms":0,"work_rhythm_days_root_execution_intervals_ms":0,"work_rhythm_days_work_rhythm_days_ms":0,"work_rhythm_days_work_rhythm_ms":3.4,"work_rhythm_days_session_diagnostics_ms":0.3,"work_rhythm_days_aggregate_ms":3.7},"status":"discard","description":"Remove the unused root-turn ordinal projection from interval aggregation; the critical path did not improve.","timestamp":1788385305213,"segment":4,"confidence":null,"asi":{"hypothesis":"The ordinal field was no longer used after removing the inner ordering, so dropping it from the SQL projection might reduce interval aggregation work.","observations":"The seven-sample median was 11.67 ms versus the kept 11.07 ms; guarded data and byte counts passed.","rollback_reason":"The projection removal did not improve the primary metric and had no measurable query-phase benefit.","next_action_hint":"Keep the existing projection and focus on larger materialization or scheduling changes."}}
{"run":30,"commit":"cfde3e2","metric":13.088,"metrics":{"complete_ms":39.012,"critical_bytes":37891,"complete_bytes":265412,"data_regressions":0,"harnesses_ms":1.688,"harnesses_bytes":62,"activity_ms":12.151,"activity_bytes":34040,"work_rhythm_ms":8.703,"work_rhythm_bytes":3789,"work_rhythm_days_ms":21.997,"work_rhythm_days_bytes":205026,"session_shape_ms":25.702,"session_shape_bytes":1157,"usage_ms":14.621,"usage_bytes":17466,"cache_misses_ms":18.151,"cache_misses_bytes":3872,"activity_root_rollups_ms":0,"activity_root_execution_intervals_ms":0,"activity_cache_misses_ms":2,"activity_aggregate_ms":0.7,"work_rhythm_root_rollups_ms":0,"work_rhythm_root_execution_intervals_ms":0,"work_rhythm_work_rhythm_ms":1.3,"work_rhythm_session_diagnostics_ms":0,"work_rhythm_aggregate_ms":1.3,"work_rhythm_days_root_rollups_ms":0,"work_rhythm_days_root_execution_intervals_ms":0,"work_rhythm_days_work_rhythm_days_ms":0,"work_rhythm_days_work_rhythm_ms":3.2,"work_rhythm_days_session_diagnostics_ms":0.3,"work_rhythm_days_aggregate_ms":3.4},"status":"discard","description":"Add a covering cache-miss index on a copied benchmark database; it did not improve the representative core workload.","timestamp":1788385383058,"segment":4,"confidence":null,"asi":{"hypothesis":"A covering index on cache-miss started time, tree join, grouping fields, and cost columns should reduce table lookups in the activity cache-miss query.","observations":"On a copied snapshot the cache-miss phase remained about 2 ms and the median critical_ms rose to 13.09 ms versus 11.07; response guards passed.","rollback_reason":"The large covering index added no measured cache-miss benefit and degraded the representative primary timing.","next_action_hint":"Delete the discarded migration and continue using the existing cache-miss indexes; focus on the kept full-rollup coalescing path."}}
{"run":31,"commit":"f389108","metric":11.474,"metrics":{"complete_ms":34.27,"critical_bytes":37891,"complete_bytes":265412,"data_regressions":0,"harnesses_ms":1.525,"harnesses_bytes":62,"activity_ms":9.564,"activity_bytes":34040,"work_rhythm_ms":10.894,"work_rhythm_bytes":3789,"work_rhythm_days_ms":5.963,"work_rhythm_days_bytes":205026,"session_shape_ms":22.263,"session_shape_bytes":1157,"usage_ms":21.291,"usage_bytes":17466,"cache_misses_ms":20.786,"cache_misses_bytes":3872,"activity_root_rollups_ms":0.5,"activity_root_execution_intervals_ms":3.9,"activity_cache_misses_ms":2,"activity_aggregate_ms":0.6,"work_rhythm_root_rollups_ms":0,"work_rhythm_root_execution_intervals_ms":0,"work_rhythm_work_rhythm_ms":1.2,"work_rhythm_session_diagnostics_ms":0,"work_rhythm_aggregate_ms":1.2,"work_rhythm_days_root_rollups_ms":0,"work_rhythm_days_root_execution_intervals_ms":0,"work_rhythm_days_work_rhythm_days_ms":0,"work_rhythm_days_work_rhythm_ms":2.9,"work_rhythm_days_session_diagnostics_ms":0.2,"work_rhythm_days_aggregate_ms":3},"status":"keep","description":"Format the kept dashboard scheduling, payload, repository-cache, and migration changes.","timestamp":1788385535160,"segment":4,"confidence":null,"asi":{"hypothesis":"Formatting should preserve the kept implementation and make the affected files pass the repository formatter.","observations":"The formatted source passed the benchmark guards; timing was 11.47/34.27 ms, within the existing run-to-run range but not a primary improvement. Formatting also normalized pre-existing wrapped lines in affected files.","data_guard":"All guarded responses matched.","simplicity":"Formatting only; no semantic changes intended."}}
{"run":32,"commit":"f389108","metric":12.532,"metrics":{"complete_ms":37.571,"critical_bytes":37891,"complete_bytes":265412,"data_regressions":0,"harnesses_ms":1.748,"harnesses_bytes":62,"activity_ms":10.733,"activity_bytes":34040,"work_rhythm_ms":11.825,"work_rhythm_bytes":3789,"work_rhythm_days_ms":6.124,"work_rhythm_days_bytes":205026,"session_shape_ms":16.644,"session_shape_bytes":1157,"usage_ms":22.43,"usage_bytes":17466,"cache_misses_ms":16.48,"cache_misses_bytes":3872,"activity_root_rollups_ms":0.5,"activity_root_execution_intervals_ms":4,"activity_cache_misses_ms":2.2,"activity_aggregate_ms":0.7,"work_rhythm_root_rollups_ms":0,"work_rhythm_root_execution_intervals_ms":0,"work_rhythm_work_rhythm_ms":1.2,"work_rhythm_session_diagnostics_ms":0,"work_rhythm_aggregate_ms":1.2,"work_rhythm_days_root_rollups_ms":0,"work_rhythm_days_root_execution_intervals_ms":0,"work_rhythm_days_work_rhythm_days_ms":0,"work_rhythm_days_work_rhythm_ms":3,"work_rhythm_days_session_diagnostics_ms":0.2,"work_rhythm_days_aggregate_ms":3.2},"status":"discard","description":"Run an eleven-sample final confirmation of the kept core-first schedule and rollup cache.","timestamp":1788385569684,"segment":4,"confidence":null,"asi":{"hypothesis":"A final eleven-sample run should characterize the stable timing range of the kept implementation after formatting and schema validation.","observations":"The confirmation median was 12.53 ms critical and 37.57 ms complete, above the best 11.07/37.70 run but within the observed request-order noise; all guards passed.","rollback_reason":"This no-change confirmation did not beat the kept result.","next_action_hint":"Keep the current implementation and use the targeted checks plus response guards as the final confidence signal."}}
{"run":33,"commit":"f389108","metric":12.957,"metrics":{"complete_ms":36.449,"critical_bytes":37891,"complete_bytes":265412,"data_regressions":0,"harnesses_ms":9.52,"harnesses_bytes":62,"activity_ms":11.029,"activity_bytes":34040,"work_rhythm_ms":11.779,"work_rhythm_bytes":3789,"work_rhythm_days_ms":6.217,"work_rhythm_days_bytes":205026,"session_shape_ms":12.118,"session_shape_bytes":1157,"usage_ms":21.125,"usage_bytes":17466,"cache_misses_ms":22.053,"cache_misses_bytes":3872,"activity_root_rollups_ms":0.5,"activity_root_execution_intervals_ms":4.2,"activity_cache_misses_ms":2.2,"activity_aggregate_ms":0.7,"work_rhythm_root_rollups_ms":0,"work_rhythm_root_execution_intervals_ms":0,"work_rhythm_work_rhythm_ms":1.4,"work_rhythm_session_diagnostics_ms":0,"work_rhythm_aggregate_ms":1.4,"work_rhythm_days_root_rollups_ms":0,"work_rhythm_days_root_execution_intervals_ms":0,"work_rhythm_days_work_rhythm_days_ms":0,"work_rhythm_days_work_rhythm_ms":3.2,"work_rhythm_days_session_diagnostics_ms":0.2,"work_rhythm_days_aggregate_ms":3.4},"status":"discard","description":"Increase SQLite's page cache to 32 MB; the representative workload became slower.","timestamp":1788385642341,"segment":4,"confidence":null,"asi":{"hypothesis":"A 32 MB SQLite page cache may keep the large archive's hot indexes resident and reduce cold materialization latency.","observations":"The candidate measured 12.96 ms critical and 36.45 ms complete versus 11.07/37.70; no response regressions occurred.","rollback_reason":"The larger page cache degraded the primary timing on the representative workload.","next_action_hint":"Leave the default SQLite page cache unchanged and avoid connection-level tuning without a clearer cold-read benefit."}}
{"run":34,"commit":"f389108","metric":11.595,"metrics":{"complete_ms":34.713,"critical_bytes":37891,"complete_bytes":265412,"data_regressions":0,"harnesses_ms":1.349,"harnesses_bytes":62,"activity_ms":9.799,"activity_bytes":34040,"work_rhythm_ms":11.217,"work_rhythm_bytes":3789,"work_rhythm_days_ms":14.264,"work_rhythm_days_bytes":205026,"session_shape_ms":13.032,"session_shape_bytes":1157,"usage_ms":21.826,"usage_bytes":17466,"cache_misses_ms":22.213,"cache_misses_bytes":3872,"activity_root_rollups_ms":0.6,"activity_root_execution_intervals_ms":4.4,"activity_cache_misses_ms":1.8,"activity_aggregate_ms":0.7,"work_rhythm_root_rollups_ms":0,"work_rhythm_root_execution_intervals_ms":0,"work_rhythm_work_rhythm_ms":1.3,"work_rhythm_session_diagnostics_ms":0,"work_rhythm_aggregate_ms":1.3,"work_rhythm_days_root_rollups_ms":0,"work_rhythm_days_root_execution_intervals_ms":0,"work_rhythm_days_work_rhythm_days_ms":0,"work_rhythm_days_work_rhythm_ms":3.2,"work_rhythm_days_session_diagnostics_ms":0.3,"work_rhythm_days_aggregate_ms":3.5},"status":"discard","description":"Use a grouped cost-only cache-miss query for activity; it preserved exact data but did not improve the core path.","timestamp":1788385744273,"segment":4,"confidence":null,"asi":{"hypothesis":"Keep the original grouped cache-miss summation order while selecting only group costs, reducing projection and mapping work without floating-point drift.","observations":"The candidate passed exact response guards but measured 11.60 ms critical versus the 11.07 ms kept baseline; the 1.8 ms cache-miss phase was not a stable improvement.","rollback_reason":"The narrower query added duplicate SQL and did not improve the primary metric.","next_action_hint":"Retain the original summarizeCacheMisses path for activity and do not split its exact aggregation logic."}}
{"run":35,"commit":"f389108","metric":12.687,"metrics":{"complete_ms":37.988,"critical_bytes":37891,"complete_bytes":265412,"data_regressions":0,"harnesses_ms":10.862,"harnesses_bytes":62,"activity_ms":10.405,"activity_bytes":34040,"work_rhythm_ms":11.998,"work_rhythm_bytes":3789,"work_rhythm_days_ms":7.654,"work_rhythm_days_bytes":205026,"session_shape_ms":14.613,"session_shape_bytes":1157,"usage_ms":13.354,"usage_bytes":17466,"cache_misses_ms":24.781,"cache_misses_bytes":3872,"activity_root_rollups_ms":0.5,"activity_root_execution_intervals_ms":4.3,"activity_cache_misses_ms":2.2,"activity_aggregate_ms":0.7,"work_rhythm_root_rollups_ms":0,"work_rhythm_root_execution_intervals_ms":0,"work_rhythm_work_rhythm_ms":1.4,"work_rhythm_session_diagnostics_ms":0,"work_rhythm_aggregate_ms":1.4,"work_rhythm_days_root_rollups_ms":0,"work_rhythm_days_root_execution_intervals_ms":0,"work_rhythm_days_work_rhythm_days_ms":0,"work_rhythm_days_work_rhythm_ms":3.5,"work_rhythm_days_session_diagnostics_ms":0.3,"work_rhythm_days_aggregate_ms":3.7},"status":"discard","description":"Reduce the transient rollup-cache window from 25 ms to 20 ms; core sharing became less reliable.","timestamp":1788385812786,"segment":4,"confidence":null,"asi":{"hypothesis":"A 20 ms window might retain initial-request coalescing while reducing the freshness window of the in-memory materialization.","observations":"The five-sample median was 12.69 ms critical versus the kept 11.07 ms baseline; complete_ms was 37.99 and cache sharing was less reliable.","rollback_reason":"The shorter window degraded the primary path and did not provide a meaningful safety benefit.","next_action_hint":"Restore the 25 ms window, which consistently coalesces the initial core requests and deferred days."}}
{"run":36,"commit":"f389108","metric":12.908,"metrics":{"complete_ms":37.212,"critical_bytes":37891,"complete_bytes":265412,"data_regressions":0,"harnesses_ms":11.919,"harnesses_bytes":62,"activity_ms":11.73,"activity_bytes":34040,"work_rhythm_ms":11.633,"work_rhythm_bytes":3789,"work_rhythm_days_ms":16.345,"work_rhythm_days_bytes":205026,"session_shape_ms":24.034,"session_shape_bytes":1157,"usage_ms":22.656,"usage_bytes":17466,"cache_misses_ms":17.004,"cache_misses_bytes":3872,"activity_root_rollups_ms":0.6,"activity_root_execution_intervals_ms":4.2,"activity_cache_misses_ms":2.3,"activity_aggregate_ms":0.7,"work_rhythm_root_rollups_ms":0,"work_rhythm_root_execution_intervals_ms":0,"work_rhythm_work_rhythm_ms":1.4,"work_rhythm_session_diagnostics_ms":0,"work_rhythm_aggregate_ms":1.4,"work_rhythm_days_root_rollups_ms":0,"work_rhythm_days_root_execution_intervals_ms":0,"work_rhythm_days_work_rhythm_days_ms":0,"work_rhythm_days_work_rhythm_ms":3.3,"work_rhythm_days_session_diagnostics_ms":0.2,"work_rhythm_days_aggregate_ms":3.6},"status":"discard","description":"Repeat the restored kept implementation after restarting the benchmark server; this sample was timing noise.","timestamp":1788385900659,"segment":4,"confidence":null,"asi":{"hypothesis":"A fresh server restart should confirm the kept implementation still uses the 25 ms cache and active root-turn index.","observations":"The five-sample median was 12.91 ms critical and 37.21 ms complete, above the best 11.07 ms result; all guards passed and no source changes were present.","rollback_reason":"This was a no-change confirmation and did not beat the kept timing.","next_action_hint":"Use the existing best run for reporting; no further runtime tuning is justified without a new bottleneck measurement."}}
