{"run":47,"commit":"5f2f055","metric":6.3,"metrics":{"complete_ms":26.553,"critical_bytes":37891,"complete_bytes":265412,"data_regressions":0,"harnesses_ms":1.438,"harnesses_bytes":62,"activity_ms":4.43,"activity_bytes":34040,"work_rhythm_ms":5.928,"work_rhythm_bytes":3789,"work_rhythm_days_ms":5.491,"work_rhythm_days_bytes":205026,"session_shape_ms":15.478,"session_shape_bytes":1157,"usage_ms":20.095,"usage_bytes":17466,"cache_misses_ms":18.726,"cache_misses_bytes":3872,"activity_root_rollups_ms":0.5,"activity_root_execution_intervals_ms":0,"activity_cache_misses_ms":0.9,"activity_aggregate_ms":0.7,"work_rhythm_root_rollups_ms":0,"work_rhythm_root_execution_intervals_ms":0,"work_rhythm_work_rhythm_ms":1.5,"work_rhythm_session_diagnostics_ms":0,"work_rhythm_aggregate_ms":1.5,"work_rhythm_days_root_rollups_ms":0,"work_rhythm_days_root_execution_intervals_ms":0,"work_rhythm_days_work_rhythm_days_ms":0,"work_rhythm_days_work_rhythm_ms":3.2,"work_rhythm_days_session_diagnostics_ms":0.2,"work_rhythm_days_aggregate_ms":3.7},"status":"discard","description":"Replace root-rollup SQL ordering with an explicit in-memory sort; removing SQLite's temporary B-tree did not improve the critical path.","timestamp":1788389715566,"segment":4,"confidence":2.184339662897377,"asi":{"hypothesis":"Sorting root rollup rows in JavaScript should preserve deterministic root order while letting SQLite skip its outer temporary B-tree.","observations":"The benchmark passed all guards and measured 6.300 ms critical and 26.553 ms complete. The candidate did not beat the kept 5.954 ms critical result, so the SQL sort removal produced no demonstrated benefit.","rollback_reason":"Moving the sort from SQLite to JavaScript added complexity without a primary improvement; the query's outer sort is not a material bottleneck after persisted intervals.","next_action_hint":"Restore SQL ordering and focus on the remaining larger architectural worker-thread hypothesis only if it can reduce synchronous request contention."}}
{"run":48,"commit":"f821cdf","metric":5.851,"metrics":{"complete_ms":25.206,"critical_bytes":37891,"complete_bytes":265412,"data_regressions":0,"harnesses_ms":1.185,"harnesses_bytes":62,"activity_ms":3.272,"activity_bytes":34040,"work_rhythm_ms":5.346,"work_rhythm_bytes":3789,"work_rhythm_days_ms":6.993,"work_rhythm_days_bytes":205026,"session_shape_ms":19.255,"session_shape_bytes":1157,"usage_ms":17.574,"usage_bytes":17466,"cache_misses_ms":18.042,"cache_misses_bytes":3872,"activity_root_rollups_ms":0,"activity_root_execution_intervals_ms":0,"activity_cache_misses_ms":0.9,"activity_aggregate_ms":0.6,"work_rhythm_root_rollups_ms":0,"work_rhythm_root_execution_intervals_ms":0,"work_rhythm_work_rhythm_ms":1.1,"work_rhythm_session_diagnostics_ms":0,"work_rhythm_aggregate_ms":1.1,"work_rhythm_days_root_rollups_ms":0,"work_rhythm_days_root_execution_intervals_ms":0,"work_rhythm_days_work_rhythm_days_ms":0,"work_rhythm_days_work_rhythm_ms":3.2,"work_rhythm_days_session_diagnostics_ms":0.2,"work_rhythm_days_aggregate_ms":3.5},"status":"keep","description":"Remove the redundant root-range predicate from the scoped cache-miss rows.","timestamp":1788389818185,"segment":4,"confidence":1.8703438395415475,"asi":{"hypothesis":"Once the recursive cache-miss tree seeds only roots in range, the scoped root.started_at/root.updated_at predicate is logically redundant and can be removed to reduce per-row work.","observations":"The five-sample median was 5.851 ms critical and 25.206 ms complete versus 5.954/27.043 ms for the range-predicate candidate. Activity cache-miss time was 0.9 ms and all guards passed.","data_guard":"Zero data regressions; activity and cache-miss responses remained identical to references.","simplicity":"Deletes one redundant comparison and one bound parameter with no schema or response change."}}
{"run":49,"commit":"f821cdf","metric":7.523,"metrics":{"complete_ms":29.196,"critical_bytes":37891,"complete_bytes":265412,"data_regressions":0,"harnesses_ms":4.83,"harnesses_bytes":62,"activity_ms":5.772,"activity_bytes":34040,"work_rhythm_ms":6.007,"work_rhythm_bytes":3789,"work_rhythm_days_ms":10.499,"work_rhythm_days_bytes":205026,"session_shape_ms":16.08,"session_shape_bytes":1157,"usage_ms":18.955,"usage_bytes":17466,"cache_misses_ms":15.585,"cache_misses_bytes":3872,"activity_root_rollups_ms":0.5,"activity_root_execution_intervals_ms":0,"activity_cache_misses_ms":0.9,"activity_aggregate_ms":0.7,"work_rhythm_root_rollups_ms":0,"work_rhythm_root_execution_intervals_ms":0,"work_rhythm_work_rhythm_ms":1.4,"work_rhythm_session_diagnostics_ms":0,"work_rhythm_aggregate_ms":1.4,"work_rhythm_days_root_rollups_ms":0,"work_rhythm_days_root_execution_intervals_ms":0,"work_rhythm_days_work_rhythm_days_ms":0,"work_rhythm_days_work_rhythm_ms":3.1,"work_rhythm_days_session_diagnostics_ms":0.2,"work_rhythm_days_aggregate_ms":3.3},"status":"discard","description":"Repeat the redundant cache-miss predicate removal with seven samples; the phase benefit persisted but the concurrent wall-time median was noisy.","timestamp":1788389835689,"segment":4,"confidence":1.9326424870466317,"asi":{"hypothesis":"A seven-sample repeat should confirm that removing the redundant scoped root-range comparison reduces cache-miss query work without changing responses.","observations":"The confirmation median was 7.523 ms critical and 29.196 ms complete versus 5.851/25.206 ms for the candidate; activity cache-miss timing remained 0.9 ms and all guards passed. The implementation's phase-level simplification remains safe, but wall time is request-order noisy.","rollback_reason":"This no-change confirmation did not improve the candidate's primary median; the candidate itself remains committed because no source changes were made in this run.","next_action_hint":"Retain the simple predicate removal and stop micro-tuning the cache-miss query; use a materially different worker-thread experiment only if needed."}}
{"run":50,"commit":"9f69a0c","metric":5.749,"metrics":{"complete_ms":25.397,"critical_bytes":37891,"complete_bytes":265412,"data_regressions":0,"harnesses_ms":5.672,"harnesses_bytes":62,"activity_ms":4.676,"activity_bytes":34040,"work_rhythm_ms":5.187,"work_rhythm_bytes":3789,"work_rhythm_days_ms":9.471,"work_rhythm_days_bytes":205026,"session_shape_ms":19.701,"session_shape_bytes":1157,"usage_ms":17.415,"usage_bytes":17466,"cache_misses_ms":18.01,"cache_misses_bytes":3872,"activity_root_rollups_ms":0.4,"activity_root_execution_intervals_ms":0,"activity_cache_misses_ms":0.7,"activity_aggregate_ms":0.6,"work_rhythm_root_rollups_ms":0,"work_rhythm_root_execution_intervals_ms":0,"work_rhythm_work_rhythm_ms":1.3,"work_rhythm_session_diagnostics_ms":0,"work_rhythm_aggregate_ms":1.3,"work_rhythm_days_root_rollups_ms":0,"work_rhythm_days_root_execution_intervals_ms":0,"work_rhythm_days_work_rhythm_days_ms":0,"work_rhythm_days_work_rhythm_ms":3,"work_rhythm_days_session_diagnostics_ms":0.2,"work_rhythm_days_aggregate_ms":3.2},"status":"keep","description":"Cache prepared statements for the hot overview and cache-miss read queries.","timestamp":1788389926042,"segment":4,"confidence":2.1026856240126377,"asi":{"hypothesis":"The hot overview and cache-miss SQL statements are prepared on every request even though their SQL text is static; reusing them should remove repeated parse/setup overhead from the critical activity path.","observations":"The five-sample median was 5.749 ms critical and 25.397 ms complete versus 5.851/25.206 ms for the prior candidate. Activity root-rollup and cache-miss phases were 0.4 and 0.7 ms, and all response guards passed.","data_guard":"Zero data regressions and unchanged response sizes.","simplicity":"Adds a small repository-local statement map and uses it for the overview root/spend and cache-miss summary queries; no API or query semantics change."}}
{"run":51,"commit":"ff21144","metric":5.153,"metrics":{"complete_ms":23.099,"critical_bytes":37891,"complete_bytes":265412,"data_regressions":0,"harnesses_ms":2.135,"harnesses_bytes":62,"activity_ms":3.441,"activity_bytes":34040,"work_rhythm_ms":4.765,"work_rhythm_bytes":3789,"work_rhythm_days_ms":12.396,"work_rhythm_days_bytes":205026,"session_shape_ms":14.625,"session_shape_bytes":1157,"usage_ms":16.7,"usage_bytes":17466,"cache_misses_ms":8.639,"cache_misses_bytes":3872,"activity_root_rollups_ms":0,"activity_root_execution_intervals_ms":0,"activity_cache_misses_ms":0.7,"activity_aggregate_ms":0.7,"work_rhythm_root_rollups_ms":0,"work_rhythm_root_execution_intervals_ms":0,"work_rhythm_work_rhythm_ms":1.2,"work_rhythm_session_diagnostics_ms":0,"work_rhythm_aggregate_ms":1.2,"work_rhythm_days_root_rollups_ms":0,"work_rhythm_days_root_execution_intervals_ms":0,"work_rhythm_days_work_rhythm_days_ms":0,"work_rhythm_days_work_rhythm_ms":2.7,"work_rhythm_days_session_diagnostics_ms":0.2,"work_rhythm_days_aggregate_ms":3.1},"status":"keep","description":"Confirm hot repository statement reuse with seven benchmark samples.","timestamp":1788389943512,"segment":4,"confidence":2.22849614153962,"asi":{"hypothesis":"A seven-sample repeat should confirm that prepared-statement reuse, rather than request-order variance, lowers the hot overview/cache-miss path.","observations":"The confirmation median was 5.153 ms critical and 23.099 ms complete, below the candidate's 5.749/25.397 ms. Activity cache-miss timing remained 0.7 ms, and all response guards passed; wall-time variance remains visible in deferred endpoints.","data_guard":"Zero data regressions and unchanged response sizes.","simplicity":"No implementation changes from the repository statement cache candidate.","next_action_hint":"Retain statement reuse and avoid further small parser/cache tweaks; only investigate worker-thread offloading if a new end-to-end benefit is plausible."}}
{"run":52,"commit":"ff21144","metric":6.607,"metrics":{"complete_ms":27.97,"critical_bytes":37891,"complete_bytes":265412,"data_regressions":0,"harnesses_ms":3.212,"harnesses_bytes":62,"activity_ms":5.289,"activity_bytes":34040,"work_rhythm_ms":5.8,"work_rhythm_bytes":3789,"work_rhythm_days_ms":11.245,"work_rhythm_days_bytes":205026,"session_shape_ms":16.388,"session_shape_bytes":1157,"usage_ms":11.785,"usage_bytes":17466,"cache_misses_ms":18.445,"cache_misses_bytes":3872,"activity_root_rollups_ms":0,"activity_root_execution_intervals_ms":0,"activity_cache_misses_ms":0.8,"activity_aggregate_ms":0.6,"work_rhythm_root_rollups_ms":0,"work_rhythm_root_execution_intervals_ms":0,"work_rhythm_work_rhythm_ms":1.2,"work_rhythm_session_diagnostics_ms":0,"work_rhythm_aggregate_ms":1.3,"work_rhythm_days_root_rollups_ms":0,"work_rhythm_days_root_execution_intervals_ms":0,"work_rhythm_days_work_rhythm_days_ms":0,"work_rhythm_days_work_rhythm_ms":2.9,"work_rhythm_days_session_diagnostics_ms":0.3,"work_rhythm_days_aggregate_ms":3.2},"status":"discard","description":"Re-measure the kept implementation after removing a stale discarded benchmark-only expression index.","timestamp":1788390031216,"segment":4,"confidence":2.709382151029748,"asi":{"hypothesis":"After removing the stale discarded root-seed expression index from the benchmark snapshot, a fresh run should characterize the kept implementation without an uncommitted schema advantage.","observations":"The seven-sample median was 6.607 ms critical and 27.970 ms complete, with 0 data regressions. The persisted interval and title-index paths remained active; this result is above the earlier 5.153 ms statement-cache confirmation and reflects request-order variance.","rollback_reason":"This was a no-source-change benchmark-state confirmation, not a candidate improvement.","next_action_hint":"Use this clean-snapshot measurement as the current reference and avoid further sub-millisecond query/index tuning."}}
{"run":53,"commit":"b435ef9","metric":5.451,"metrics":{"complete_ms":26.091,"critical_bytes":37891,"complete_bytes":265412,"data_regressions":0,"harnesses_ms":3.863,"harnesses_bytes":62,"activity_ms":3.233,"activity_bytes":34040,"work_rhythm_ms":4.796,"work_rhythm_bytes":3789,"work_rhythm_days_ms":7.84,"work_rhythm_days_bytes":205026,"session_shape_ms":18.699,"session_shape_bytes":1157,"usage_ms":9.984,"usage_bytes":17466,"cache_misses_ms":17.561,"cache_misses_bytes":3872,"activity_root_rollups_ms":0,"activity_root_execution_intervals_ms":0,"activity_cache_misses_ms":0.6,"activity_aggregate_ms":0.6,"work_rhythm_root_rollups_ms":0.5,"work_rhythm_root_execution_intervals_ms":0,"work_rhythm_work_rhythm_ms":1.3,"work_rhythm_session_diagnostics_ms":0,"work_rhythm_aggregate_ms":1.3,"work_rhythm_days_root_rollups_ms":0,"work_rhythm_days_root_execution_intervals_ms":0,"work_rhythm_days_work_rhythm_days_ms":0,"work_rhythm_days_work_rhythm_ms":3.1,"work_rhythm_days_session_diagnostics_ms":0.2,"work_rhythm_days_aggregate_ms":3.4},"status":"keep","description":"Persist each cache miss's root conversation to remove recursive tree construction from cache-miss summaries.","timestamp":1788390279622,"segment":4,"confidence":2.576713819368879,"asi":{"hypothesis":"The recursive cache-miss tree only maps each miss conversation to its root; persisting root_conversation_id during migration and family writes should let the summary query join the root directly.","observations":"The five-sample median was 5.451 ms critical and 26.091 ms complete versus 5.749/25.397 ms for statement reuse alone. The activity cache-miss phase fell to 0.6 ms and all guarded responses passed.","data_guard":"Zero data regressions; activity and cache-miss response bytes and JSON matched references.","simplicity":"Adds one derived foreign-key column, a backfill/index migration, a small post-lineage write update, and a direct summary query. No response contract changes."}}
